Name,Country,Year,Price,Rating,Rating Counter,Tastes
Hautes-Côtes de Beaune Le Clou 6x 75cl,Frankreich,2023,119.70,3.9,184,"['38.0041%', '23.8946%', '0px', '64.5186%']"
Naturaplan Bio Château Gombaude-Guillot Pomerol L'école Famille Laval,Frankreich,2019,47.50,4.3,3404,"['74.7643%', '50.2031%', '5.35638%', '52.2332%']"
Navarra DO Gran Feudo Crianza 626 Barricas,Spanien,2017,8.95,3.3,351,"['52.3441%', '51.1883%', '9.458%', '38.3239%']"
Poggio Solivo Merlot Ticino DOC,Schweiz,2020,9.95,3.4,478,"['60.1388%', '45.6977%', '8.26824%', '56.1518%']"
Sangiovese di Romagna DOC Appassimento Galante,Italien,2021,9.95,4.0,62,"['67.5%', '43.4%', '8.5%', '19%']"
Terre di Chieti IGT Leggermente Appassite Patroferno,Italien,2021,13.50,4.2,25,"['44.6395%', '37.6861%', '0px', '35.5465%']"
Toscana IGT Rèmole Rosso Frescobaldi,Italien,2022,9.50,3.6,44184,"['42.1008%', '38.5194%', '5.18006%', '45.0895%']"
Barolo DOCG Palladino,Italien,2019,9.95,4.0,3975,None
"Naturaplan Bio Blauer Zweigelt Biokult, Niederösterreich Qualitätswein",Österreich,2022,11.50,3.1,178,"['42.5%', '56.8229%', '0px', '65.8802%']"
Naturaplan Bio-Côtes du Roussillon AOP John Wine Cazes,Frankreich,2022,8.70,3.6,329,"['64.0636%', '57.7696%', '5.95957%', '64.5326%']"
Naturaplan Bio-Pinot Noir Neuchâtel AOC Domaine des Coccinelles,Schweiz,2022,19.50,3.5,207,"['18.1143%', '20.1626%', '0px', '72.303%']"
Primitivo di Manduria DOC Identità,Italien,2018,26.50,3.9,2844,"['62.5263%', '22.9692%', '43.7646%', '20.4987%']"
Priorat DOQ Ritme Acustic Celler,Spanien,2021,13.95,3.9,8229,"['84.5273%', '48.659%', '10.0506%', '53.3574%']"
Valais AOC Pinot Noir Telegram Maye,Schweiz,2022,14.95,3.8,62,"['13.7866%', '27.2317%', '6.98171%', '63.8598%']"
Château du Glana Saint-Julien AC,Frankreich,2018,24.95,3.9,9300,None
Colchagua Valley Carmenère Los Vascos,Chile,2019,17.50,3.9,3766,"['75.3552%', '33.3314%', '5.74816%', '43.1171%']"
Genève AOC Gamaret La clémence Cave de Genève,Schweiz,2020,19.95,3.5,408,None
Naturaplan Bio Château Peybonhomme Les Tours AOC,Frankreich,2021,12.50,3.9,2641,"['63.1717%', '11.275%', '38.522%']"
Naturaplan Bio-Côtes Catalanes IGP Le Canon du Marechal Cazes,Frankreich,2022,9.95,3.4,2256,"['64.2627%', '53.6599%', '6.90833%', '58.7198%']"
Ticino DOC Merlot Biasca Premium,Schweiz,2021,21.95,3.7,1375,"['62.1212%', '39.1915%', '7.96057%', '45.2622%']"
Ticino DOC Merlot Collivo Riserva,Schweiz,2020,21.50,3.8,689,"['56.4886%', '42.9226%', '9.75437%', '49.2649%']"
Toscana IGT Rosso Villa Antinori,Italien,2020,11.50,3.8,123255,None
Valais AOC Dôle Valisiana,Schweiz,,5.50,3.1,202,"['41.3095%', '17.5%', '27.0238%', '77.9762%']"
Toscana IGT Ca'Marcanda Promis di Angelo Gaja,Italien,2021,47.95,4.1,49074,"['49.322%', '40.0115%', '5.77678%', '45.6304%']"
Château Fonplégade Saint-Emilion AC Grand Cru Classé,Frankreich,2018,49.95,4.2,6519,"['74.5028%', '54.968%', '5.55046%', '52.4558%']"
"Châteauneuf-du-Pape AOP, Mémora",Frankreich,2021,26.95,4.3,786,"['85%', '34.8191%', '0px', '44.2786%']"
Châteauneuf-du-Pape AOP Château de Nalys E. Guigal,Frankreich,2016,64.95,4.1,6279,None
Gigondas AOP Château Saint-André,Frankreich,2022,9.50,3.8,4057,"['80.3873%', '38.5045%', '7.8588%', '44.3695%']"
Rioja DOCa Reserva Ondarre,Spanien,2019,9.95,3.9,24815,"['63.9008%', '60.6697%', '7.2376%', '60.1683%']"
Savigny-lès-Beaune 1er Cru Ies Vergelesses 6x 75cl,Frankreich,2023,185.70,4.1,1374,"['33.4657%', '23.854%', '2.96247%', '65.2841%']"
Vin de Pays Roman Rouge Apologia,Schweiz,2022,13.95,3.6,2075,None
Château Langoa-Barton Saint-Julien AC 3ème Cru Classé,Frankreich,2015,52.50,4.2,12973,None
Château la Pensée Lalande-de-Pomerol,Frankreich,2020,20.95,3.9,820,"['65.2754%', '52.7512%', '0px', '51.0875%']"
Chianti Classico DOCG Riserva La Madonnina Triacca,Italien,2018,14.95,3.5,3292,"['45.6933%', '60.8658%', '0.791398%', '63.5052%']"
Lavaux AOC Saint Saphorin Domaine des Faverges Grand Cru,Schweiz,2022,20.95,3.6,607,None
Naturaplan Bio Chianti classico Concadoro DOCG,Italien,2020,12.95,3.2,456,"['44.7235%', '63.0971%', '7.375%', '62.2721%']"
Neusiedlersee DAC Zweigelt Scheiblhofer,Österreich,2022,10.95,3.6,1508,"['44.4736%', '47.2182%', '16.6807%', '59.3719%']"
Santenay 1er Cru Clos des Mouches 6x 75cl,Frankreich,2023,173.70,4.2,722,"['32.5334%', '22.8982%', '13.1115%', '61.9811%']"
Château d'Escurac Médoc AC,Frankreich,2018,22.50,3.8,2777,"['71.6834%', '73.5671%', '8.76809%', '67.8081%']"
Châteauneuf-du-Pape AOP Château La Nerthe,Frankreich,2020,49.95,4.2,24451,None
Corton les Hautes-Mourottes Grand Cru 6x 75cl,Frankreich,2023,389.70,4.4,31,"['27.4071%', '16.9857%', '0px', '68.0571%']"
Isola dei Nuraghi IGT Korem Argiolas,Italien,2020,33.95,4.1,5365,"['82.5082%', '43.35%', '26.8012%', '28.5994%']"
Naturaplan Bio Gigondas AOP Terra Amata,Frankreich,2022,18.95,3.4,584,"['61.7062%', '55.4685%', '10.6952%', '53.3733%']"
Rioja Azabache Crianza DOCa,Spanien,2020,5.95,3.5,5689,"['60.1843%', '57.9376%', '11.6868%', '58.5394%']"
Rioja DOCa Reserva Viña Tondonia Lopez de Heredia,Spanien,2011,42.50,4.2,74325,None
St-Estèphe AOC Château Tour de Pez,Frankreich,2016,23.95,3.8,5813,"['74.3176%', '74.753%', '7.38039%', '72.8931%']"
Valais AOC Syrah Valisiana,Schweiz,,8.95,3.3,138,"['59.891%', '65.4079%', '3.00188%', '55.2312%']"
Naturaplan Bio Catalunya DO Boira Garnatxa Negra Raimat,Spanien,2019,15.95,3.4,1262,"['74.5885%', '42.5844%', '8.28675%', '42.3324%']"
Pinotage Durbanville WO South Africa Diemersdal,Südafrika,2022,22.95,3.9,5627,None
Rasteau AOP Château Saint-André,Frankreich,2021,12.95,3.8,4057,"['80.3873%', '38.5045%', '7.8588%', '44.3695%']"
Amarone della Valpolicella Conte di Valle Palazzo Maffei DOC,Italien,2017,41.95,4.2,2338,"['83.4866%', '22.2669%', '51.1548%', '23.1804%']"
Bolgheri DOC Il Seggio Poggio al Tesoro,Italien,2021,33.50,4.1,16101,None
Maremma Toscana IGT Botrosecco Le Mortelle Marchesi Antinori,Italien,2021,21.95,3.9,10114,None
Ribera del Duero DO Tempranillo Roble Nebla Vicente Gandia,Spanien,2022,6.70,3.1,182,"['67.5%', '62.2235%', '0px', '67.9546%']"
Rioja DOCa Reserva Bodegas Roda,Spanien,2019,31.50,4.2,27237,"['64.2269%', '61.9301%', '12.1139%', '59.9852%']"
Magnum Toscana IGT Insoglio del Cinghiale Tenuta di Biserno,Italien,2021,52.00,4.0,28456,None
Alentejo DOC Reserva Herdade do Peso,Portugal,2020,24.50,4.1,5827,"['75.0865%', '46.122%', '15.9903%', '39.8211%']"
Amarone della Valpolicella DOCG Riserva Conte di Valle Palazzo Maffei,Italien,2016,41.95,4.2,2338,"['83.4866%', '22.2669%', '51.1548%', '23.1804%']"
Cabernet Sauvignon Coonawarra The Siding Wynns Estate,Australien,2021,14.95,3.6,4673,"['65.9876%', '52.7971%', '11.6003%', '50.8015%']"
Cabernet Sauvignon Wester Cape South Africa WO Selection Kleine Zalze,Südafrika,2020,21.50,3.1,165,"['60.9939%', '64.8773%', '18.2117%', '63.3804%']"
Chianti Classico DOCG Riserva La Madonnina Triacca,Italien,2018,8.95,3.5,3292,"['45.6933%', '60.8658%', '0.791398%', '63.5052%']"
Graubünden AOC Maienfeld Pinot Noir Bündner Banner,Schweiz,2022,17.95,3.6,549,"['9.20675%', '16.6445%', '8.68253%', '72.0926%']"
Magnum Amarone della Valpolicella Classico DOCG Zeni,Italien,2019,49.95,4.2,15610,None
Naturaplan Bio Alicante DO Viñas Viejas Castillo de Alicante,Spanien,2018,8.95,3.4,261,"['55.2565%', '47.2794%', '0px', '48.4379%']"
Nederburg Cabernet Sauvignon Western Cape WO,Südafrika,2021,15.50,3.6,2830,"['71.0047%', '64.4311%', '8.47547%', '59.1288%']"
Provincia di Verona IGT Corvina Ripa Magna,Italien,2021,15.50,4.1,14727,"['64.081%', '40.2505%', '20.1321%', '30.0209%']"
Rioja Reserva DOCa Viña Real,Spanien,2017,12.65,3.8,12425,None
Sardegna IGT Turriga Isola dei Nuraghi Argiolas,Italien,2019,84.00,4.4,15707,None
Sforzato di Valtellina DOCG San Domenico Triacca,Italien,2018,29.50,4.0,2661,"['65.0643%', '75.1356%', '16.4186%', '78.6079%']"
Toscana IGT Sangiovese Fontalloro Fèlsina,Italien,2019,47.50,4.2,13634,"['50.9029%', '45.373%', '9.93018%', '49.6938%']"
Château Beau-Séjour Bécot Saint-Emilion 1er Grand Cru Classé B AOC,Frankreich,2018,82.50,4.3,12798,None
Langhe DOC Nebbiolo Argo Villadoria,Italien,2021,9.95,3.6,671,"['66.5221%', '76.9172%', '0px', '84.603%']"
Naturaplan Bio Languedoc-Roussillon Cap au Sud Domaine Cazes,Frankreich,2021,7.50,3.5,4294,"['61.9854%', '51.8081%', '10.7423%', '55.7671%']"
Ribera del Duero DO Pruno Finca Villacreces,Spanien,2020,12.70,3.8,39292,"['62.6217%', '57.4704%', '10.0558%', '61.4452%']"
Ripasso della Valpolicella DOC Superiore Brigaldara,Italien,2021,16.50,3.9,7151,"['63.8917%', '39.7449%', '32.894%', '29.0211%']"
Salento IGP Susumaniello Feudi Salentini,Italien,2021,13.00,4.1,180,"['69.6984%', '33.3619%', '22.8399%', '27.5551%']"
Ticino DOC Merlot Giornico Oro Gialdi Vini,Schweiz,2021,24.95,3.8,2008,"['59.6022%', '37.8034%', '17.0947%', '45.5666%']"
Vinho Regional Alentejano Reserva Howards Folly,Portugal,2016,29.95,4.2,616,None
Douro DOC Pomares Tinto Quinta Nova,Portugal,2021,11.50,3.9,5316,None
Château Franc Grace-Dieu Grand Cru St-Emilion AOC,Frankreich,2019,24.95,3.7,3343,"['71.4985%', '58.7682%', '3.41697%', '54.8274%']"
Château Phélan-Ségur Saint-Estèphe AC,Frankreich,2020,57.50,4.1,28449,None
Dão DOC Taboadella Touriga Nacional Reserva,Portugal,2020,23.50,4.1,829,"['63.7132%', '50.2078%', '2.95101%', '54.5199%']"
Ladoix 1er Cru les Basses Mourottes 6x 75cl,Frankreich,2023,179.70,4.0,305,"['35.7584%', '25.6077%', '1.57678%', '64.1517%']"
Maremma Toscana DOC Poggio Bestiale Fattoria di Magliano,Italien,2018,37.50,4.0,3323,"['53.8723%', '45.3679%', '10.6521%', '46.0186%']"
Neuchâtel AOC Pinot Noir Domaine Saint-Sébaste,Schweiz,2022,21.95,3.7,408,"['14.2443%', '17.9252%', '6.53629%', '67.0714%']"
Neusiedlersee DAC Zweigelt Unplugged Hannes Reeh,Österreich,2021,24.95,4.1,10103,None
Valais AOC Assemblage Rouge La Perle Noire Domaine du Mont d'Or,Schweiz,2022,19.95,3.8,573,None
Valais AOC Syrah Les Perlines Maison Gilliard,Schweiz,2022,19.95,3.8,408,"['64.8129%', '64.4831%', '12.3006%', '57.4034%']"
Western Cape WO Manor Nederburg House Cabernet Sauvignon,Südafrika,2019,14.50,3.5,3865,"['75.2297%', '62.6543%', '13.0266%', '61.9067%']"
Beffroi du Barrail Saint Emilion AOC,Frankreich,2020,10.95,3.9,3220,"['72.6717%', '55.4555%', '3.91954%', '52.4396%']"
Cabernet Sauvignon California Founders' Estate Beringer 6x 75cl,USA,2020,49.50,3.7,39181,"['85%', '52.7225%', '13.9572%', '42.781%']"
Château Rouget Pomerol AOC,Frankreich,2017,45.95,4.2,7355,None
Dolcetto d'Alba DOC Piazzo,Italien,2021,8.95,3.2,316,"['49.5332%', '42.2861%', '14.0605%', '30.2656%']"
Geschenkbox 2x75cl Sicilia DOC Noto Rosso Zisola & Sicilia DOC Doppiozeta Noto Rosso Zisola,Italien,,44.25,4.0,3457,"['71.0102%', '42.0743%', '22.1956%', '35.2587%']"
Gevrey-Chambertin 1er cru la Romanée Monopole 6x 75cl,Frankreich,2023,525.00,4.3,646,"['43.8045%', '40.3105%', '6.42949%', '71.8626%']"
Magnum Toscana IGT Rosso Villa Antinori,Italien,2020,39.50,3.8,123255,None
Naturaplan Bio Nussbaumer Cuvée Barrique,Schweiz,2022,12.95,3.8,174,None
Nuits-Saint-Georges AOC Bichot,Frankreich,2021,46.50,4.0,1742,"['41.274%', '34.5939%', '6.00605%', '66.7133%']"
Rioja DOCa Gran Reserva Marqués de Riscal,Spanien,2016,43.50,4.2,22695,"['65.5419%', '58.5532%', '9.80006%', '60.2741%']"
Valais AOC Humagne Rouge Bibacchus,Schweiz,2021,9.30,3.6,2211,None
Aigle Noir G. Bertrand Pays d'Oc IGP,Frankreich,2022,13.95,3.5,1876,"['50.3234%', '49.6852%', '0.820038%', '61.5406%']"
Carmel King David Concord Koscher,Carmel,,16.95,3.3,241,"['64%', '53.1579%', '28.6053%', '42.5%']"
Château Laroque Saint-Émilion Grand Cru Classé AOC,Frankreich,2017,36.50,4.1,19842,"['72.3165%', '56.078%', '7.95096%', '53.5459%']"
Château Rol Valentin Saint-Emilion AOC Grand Cru,Frankreich,2018,32.95,4.1,3751,"['73.2885%', '52.2959%', '14.2549%', '50.5699%']"
Free From Naturae Syrah Pays d'Oc IGP,Frankreich,2022,9.95,3.5,2385,"['61.8022%', '55.216%', '6.89027%', '62.3419%']"
Langhe DOC Nebbiolo Sogni al Campo Terre da Vino,Italien,2021,15.90,3.3,184,"['39.5491%', '58.0617%', '18.4335%', '57.8244%']"
Manduria DOP Primitivo Uno Riserva Masseria la Volpe,Italien,2020,19.95,4.3,3695,"['69.4195%', '26.2311%', '42.2514%', '13.4217%']"
Naturaplan Bio Château Peybonhomme Les Tours Cru Bourgeois AOC,Frankreich,2021,6.95,3.5,1666,"['64.8245%', '63.0158%', '4.57865%', '67.0101%']"
Toscana IGT Il Pino di Biserno Tenuta di Biserno,Italien,2021,52.50,4.3,19398,None
Valais AOC Humagne Rouge Maître de Chais,Schweiz,2021,28.95,3.6,579,None
Chianti Classico DOCG Riserva Villa Antinori,Italien,2021,22.50,4.0,45107,"['48.8189%', '55.743%', '5.98123%', '62.685%']"
Babić Dalmatian Ego Fjaka Galić,Kroatien,2021,12.50,3.9,155,"['67.5%', '49.2308%', '0px', '42.5%']"
Genève AOC Merlot Barrique Domaine des Charmes,Schweiz,2021,25.95,3.8,82,"['45.1974%', '36.5965%', '0px', '51.6667%']"
Graubünden AOC Jeninser Pinot Noir Jürg Obrecht,Schweiz,2022,18.50,3.7,446,"['2.30488%', '19.6159%', '16.7117%', '64.3171%']"
Pays d'Oc IGP La Cuvée Mythique,Frankreich,2021,6.95,3.5,520,"['60.807%', '61.0322%', '4.659%', '63.3989%']"
Valais AOC Assemblage Rouge La Perle Noire Domaine du Mont d'Or,Schweiz,2022,19.95,3.8,573,None
Valais AOC Syrah Les Perlines Maison Gilliard,Schweiz,2022,19.95,3.8,408,"['64.8129%', '64.4831%', '12.3006%', '57.4034%']"
Western Cape WO Manor Nederburg House Cabernet Sauvignon,Südafrika,2019,14.50,3.5,3865,"['75.2297%', '62.6543%', '13.0266%', '61.9067%']"
Beffroi du Barrail Saint Emilion AOC,Frankreich,2020,10.95,3.9,3220,"['72.6717%', '55.4555%', '3.91954%', '52.4396%']"
Cabernet Sauvignon California Founders' Estate Beringer 6x 75cl,USA,2020,49.50,3.7,39181,"['85%', '52.7225%', '13.9572%', '42.781%']"
Château Rouget Pomerol AOC,Frankreich,2017,45.95,4.2,7355,None
Dolcetto d'Alba DOC Piazzo,Italien,2021,8.95,3.2,316,"['49.5332%', '42.2861%', '14.0605%', '30.2656%']"
Geschenkbox 2x75cl Sicilia DOC Noto Rosso Zisola & Sicilia DOC Doppiozeta Noto Rosso Zisola,Italien,,44.25,4.0,3457,"['71.0102%', '42.0743%', '22.1956%', '35.2587%']"
Gevrey-Chambertin 1er cru la Romanée Monopole 6x 75cl,Frankreich,2023,525.00,4.3,646,"['43.8045%', '40.3105%', '6.42949%', '71.8626%']"
Magnum Toscana IGT Rosso Villa Antinori,Italien,2020,39.50,3.8,123255,None
Naturaplan Bio Nussbaumer Cuvée Barrique,Schweiz,2022,12.95,3.8,174,None
Nuits-Saint-Georges AOC Bichot,Frankreich,2021,46.50,4.0,1742,"['41.274%', '34.5939%', '6.00605%', '66.7133%']"
Rioja DOCa Gran Reserva Marqués de Riscal,Spanien,2016,43.50,4.2,22695,"['65.5419%', '58.5532%', '9.80006%', '60.2741%']"
Valais AOC Humagne Rouge Bibacchus,Schweiz,2021,9.30,3.6,2211,None
Aigle Noir G. Bertrand Pays d'Oc IGP,Frankreich,2022,13.95,3.5,1876,"['50.3234%', '49.6852%', '0.820038%', '61.5406%']"
Carmel King David Concord Koscher,Carmel,,16.95,3.3,241,"['64%', '53.1579%', '28.6053%', '42.5%']"
Château Laroque Saint-Émilion Grand Cru Classé AOC,Frankreich,2017,36.50,4.1,19842,"['72.3165%', '56.078%', '7.95096%', '53.5459%']"
Château Rol Valentin Saint-Emilion AOC Grand Cru,Frankreich,2018,32.95,4.1,3751,"['73.2885%', '52.2959%', '14.2549%', '50.5699%']"
Free From Naturae Syrah Pays d'Oc IGP,Frankreich,2022,9.95,3.5,2385,"['61.8022%', '55.216%', '6.89027%', '62.3419%']"
Langhe DOC Nebbiolo Sogni al Campo Terre da Vino,Italien,2021,15.90,3.3,184,"['39.5491%', '58.0617%', '18.4335%', '57.8244%']"
Manduria DOP Primitivo Uno Riserva Masseria la Volpe,Italien,2020,19.95,4.3,3695,"['69.4195%', '26.2311%', '42.2514%', '13.4217%']"
Naturaplan Bio Château Peybonhomme Les Tours Cru Bourgeois AOC,Frankreich,2021,6.95,3.5,1666,"['64.8245%', '63.0158%', '4.57865%', '67.0101%']"
Toscana IGT Il Pino di Biserno Tenuta di Biserno,Italien,2021,52.50,4.3,19398,None
Valais AOC Humagne Rouge Maître de Chais,Schweiz,2021,28.95,3.6,579,None
Chianti Classico DOCG Riserva Villa Antinori,Italien,2021,22.50,4.0,45107,"['48.8189%', '55.743%', '5.98123%', '62.685%']"
Babić Dalmatian Ego Fjaka Galić,Kroatien,2021,12.50,3.9,155,"['67.5%', '49.2308%', '0px', '42.5%']"
Genève AOC Merlot Barrique Domaine des Charmes,Schweiz,2021,25.95,3.8,82,"['45.1974%', '36.5965%', '0px', '51.6667%']"
Graubünden AOC Jeninser Pinot Noir Jürg Obrecht,Schweiz,2022,18.50,3.7,446,"['2.30488%', '19.6159%', '16.7117%', '64.3171%']"
Pays d'Oc IGP La Cuvée Mythique,Frankreich,2021,6.95,3.5,520,"['60.807%', '61.0322%', '4.659%', '63.3989%']"
Rasteau AOC Château Saint-André,Frankreich,2022,12.95,3.8,4057,"['80.3873%', '38.5045%', '7.8588%', '44.3695%']"
Ribera del Duero DO Prima,Spanien,2021,11.20,3.6,5402,"['59.741%', '56.9138%', '14.9442%', '59.6262%']"
Toscana IGT Governo all'uso Toscano,Italien,2018,7.50,4.0,15100,"['53.0255%', '38.6686%', '17.9167%', '41.0095%']"
Valais AOC Humagne Rouge Les Perlines Maison Giliard,Schweiz,2022,19.95,3.7,63,None
Château Labégorce Margaux AOC,Frankreich,2017,34.95,4.0,17778,"['64.4306%', '64.8557%', '4.13551%', '72.0453%']"
Beaujolais Gamay Juliénas Georges Duboeuf,Frankreich,2019,11.50,4.0,222,"['0px', '4.12615%', '0px', '85%']"
Los Vascos Cabernet Sauvignon Chile Barons de Rothschild,Chile,2020,6.95,3.5,1124,"['78.2611%', '45.7897%', '5.23473%', '43.9744%']"
Médoc AOC Château Laffitte Laujac,Frankreich,2021,8.95,3.6,6327,"['69.4879%', '72.8185%', '2.63008%', '73.3591%']"
Primitivo di Manduria DOP Riserva Concura,Italien,2018,29.50,4.3,2195,"['69.5342%', '21.7177%', '47.2047%', '11.4754%']"
Saint-Chinian AOC Bardou Laurent Miquel,Frankreich,2016,15.50,4.0,709,"['66.7528%', '60.9864%', '5.68182%', '63.9593%']"
Saint-Émilion Grand Cru AOC L'Hirondelle de Faugères,Frankreich,2019,14.95,3.8,991,"['72.8878%', '56.7579%', '13.6607%', '55.4135%']"
Teperberg Cabernet Sauvignon Koscher,Efrat,,19.80,3.7,1360,"['73.3739%', '48.5393%', '16.0153%', '44.213%']"
Ticino DOC Merlot Roncobello Valsangiacomo,Schweiz,2020,20.95,3.6,810,"['56.5778%', '44.6994%', '4.22123%', '45.1937%']"
Vinho Regional Alentejano Reserva Herdade do Rocim,Portugal,2020,21.95,4.0,3377,"['68.9269%', '45.5186%', '12.7211%', '47.0533%']"
Barolo Paesi Tuoi DOCG,Italien,2018,24.95,3.9,4495,"['62.4284%', '75.3388%', '4.1007%', '79.0738%']"
Bio Naturaplan Terra Alpina Vino Rosso,Europa,2021,14.95,3.7,432,"['63.5%', '50.625%', '4.74022%', '80.3272%']"
Bündner Pinot Noir Cottinelli,Schweiz,2022,10.95,3.5,58,"['0px', '17.5%', '0px', '80%']"
Chambolle-Musigny AOC Les Cras Domaine Antonin Guyon,Frankreich,2020,59.95,4.2,1163,"['39.8996%', '32.892%', '4.25604%', '70.9291%']"
Château Pey La Tour Bordeaux AOC,Frankreich,2021,6.95,3.5,11224,"['63.9309%', '55.4998%', '4.85544%', '61.9239%']"
Le Dix de Los Vascos Domaines Barons de Rothschild,Chile,2018,49.95,4.2,6392,"['73.103%', '49.8047%', '11.6147%', '45.6458%']"
Red Blend Clancy's Peter Lehmann,Australien,2017,8.75,3.6,7376,"['77.694%', '47.7018%', '20.1441%', '41.2907%']"
Ribera del Duero DO Tempranillo Roble Pata Negra,Spanien,2022,6.70,3.5,231,"['54.7243%', '62.0093%', '8.01852%', '52.5432%']"
Ticino DOC Merlot Ligornetto,Schweiz,2021,46.50,4.2,3132,"['59.8601%', '39.3044%', '12.4251%', '46.933%']"
Toscana IGT Potenti Petra Wine,Italien,2021,28.95,4.1,2750,"['55.7378%', '45.4854%', '11.6917%', '48.865%']"
Vignoble Mayard Châteauneuf-du-Pape AOP La Crau de ma Mère,Frankreich,2019,44.95,4.2,1850,"['85%', '41.1242%', '10.4812%', '44.292%']"
Vino Nobile di Montepulciano Riserva DOCG Tenuta Trerose,Italien,2018,18.95,3.6,1186,"['54.3818%', '55.9498%', '4.24601%', '66.1033%']"
Aglianico del Vulture DOC Piano del Cerro,Italien,2020,17.95,4.2,15578,None
Château Haut-Bages Libéral Pauillac AOC 5ème Cru Classé,Frankreich,2017,47.50,4.1,19100,None
Douro DOC Reserva Blend Quinta Nova,Portugal,2021,23.95,4.2,6873,None
Efrat Judean Hills Red Koscher,Efrat,,14.50,3.1,207,"['42.5%', '46.6667%', '9.16667%', '46.6667%']"
Gevrey-Chambertin AOC La Justice A. Guyon,Frankreich,2021,49.95,4.2,2788,"['41.2572%', '34.2849%', '7.16728%', '72.3323%']"
Malbec Gran Reserva Mendoza Vineyards,Argentinien,2018,17.95,3.9,9180,"['64.5358%', '25.1786%', '14.9646%', '35.1614%']"
Primitivo di Manduria DOP Imperio Feudo,Italien,2020,22.95,4.2,7467,"['69.5596%', '24.2291%', '40.7958%', '13.3968%']"
Priorat DOQ Plaer Ritme Cellar,Spanien,2021,29.95,3.9,8229,"['84.5273%', '48.659%', '10.0506%', '53.3574%']"
Rioja DOCa Gran Reserva Imperial Bodegas Cune,Spanien,2016,65.00,4.1,92276,"['61.9754%', '58.0479%', '8.25273%', '59.6461%']"
Rioja DOCa Reserva Ardanza La Rioja Alta,Spanien,2017,32.95,4.3,77806,None
Ticino DOC Merlot Roncobello Valsangiacomo,Schweiz,2019,20.95,3.6,810,"['56.5778%', '44.6994%', '4.22123%', '45.1937%']"
Ticino DOC Oro Rosso Tenimento dell'Ör,Schweiz,2019,19.50,3.8,629,None
Pays Gamay de Romandie Rubiette,Schweiz,,3.60,2.8,131,"['29.7972%', '10.8679%', '20.8302%', '79.3774%']"
Carignano del Sulcis DOC Superiore Terre Brune Cantina di Santadi,Italien,2018,43.00,4.2,13477,"['81.4587%', '44.5607%', '30.1556%', '28.3272%']"
Chianti Classico DOCG Gran Selezione Badia a Passignano,Italien,2020,44.95,4.2,27871,"['49.9173%', '55.6974%', '8.67075%', '62.3311%']"
Chianti DOCG Selezione Donatello,Italien,2022,4.95,3.1,214,"['38.4917%', '53.7104%', '0.07292%', '65.4938%']"
Don Mendo Reserva Cariñena DO,Spanien,2018,9.95,3.7,6565,"['64.4852%', '38.5327%', '7.43857%', '41.7223%']"
España Memento Mori Bodegas Cvne,Spanien,2020,9.95,3.9,163,"['61.1035%', '41.1293%', '27.4526%', '37.7026%']"
Magnum Rioja DOCa Reserva Marqués de Riscal,Spanien,2019,34.95,4.1,227151,"['63.8968%', '59.2479%', '9.3505%', '59.4017%']"
Mendoza Vineyards Malbec Selección,Argentinien,2022,12.95,3.4,127,"['67.7944%', '26.8649%', '18.0686%', '28.1734%']"
Naturaplan Bio Bergerac AOC Mirabelle du Château de la Jaubertie,Frankreich,2020,15.95,3.9,1302,"['79.8331%', '56.183%', '22.8978%', '75.8614%']"
Piemonte DOC Barbera Amaranto Borgovecchio,Italien,2020,6.95,3.0,249,"['52.9944%', '22.8848%', '2.73315%', '63.0028%']"
Valais AOC Pinot Noir Valisiana,Schweiz,2020,6.95,3.3,169,"['0px', '19.1108%', '0px', '70.6933%']"
Zürich AOC Goldküste Pinot Noir Cabernet,Schweiz,2022,13.95,4.4,15,None
Zürich AOC Pinot Noir Kümin,Schweiz,2022,14.95,3.7,80,"['0px', '17.5%', '0px', '72.8572%']"
St-Estèphe AOC Château Lilian Ladouys,Frankreich,2016,28.95,3.9,17978,None
Château La Gurgue Margaux AOC,Frankreich,2021,24.95,3.9,3792,"['60.5863%', '62.6031%', '8.12439%', '68.8963%']"
Chianti Classico DOCG Riserva Ducale Ruffino,Italien,2020,34.00,3.9,59263,None
Côtes de Bordeaux Castillon AOC Château Cap de Faugères,Frankreich,2017,16.95,3.7,5848,None
Montefalco DOCG Sagrantino Scacciadiavoli,Italien,2017,19.95,4.1,6730,"['58.5678%', '53.2625%', '7.57991%', '45.9689%']"
Morellino di Scansano IGT Poggio Valente Fattoria Le Pupille,Italien,2019,35.50,3.7,9814,None
Pro Montagna Pinot Noir Valais AOC,Schweiz,2022,17.95,3.0,10,None
Pro Montagna Pinot Noir Valais AOC,Schweiz,2023,17.95,3.0,10,None
Terre Siciliane IGT Nero d'Avola Riserva Corvo Duca di Salaparuta,Italien,2020,12.95,3.8,7051,"['75.3488%', '43.6779%', '27.8557%', '33.3478%']"
The Prisoner Napa Valley,USA,2019,72.00,4.4,9335,"['82.5713%', '49.1236%', '12.383%', '49.0816%']"
Ticino DOC Carato Merlot Vini e Distillati Angelo Delea,Schweiz,2020,36.00,4.1,2100,"['62.2259%', '36.5833%', '11.0304%', '41.1104%']"
Valais AOC Pinot Noir Valisiana,Schweiz,,6.95,3.3,169,"['0px', '19.1108%', '0px', '70.6933%']"
Vin de Pays Suisse Akkurat Staatskellerei Zürich,Schweiz,2021,16.50,2.6,26,"['35.0385%', '41.6538%', '32.0385%', '39.5%']"
Zinfandel California Beringer Founders' Estate,USA,2020,16.50,3.8,14558,"['80.6801%', '29.5433%', '40.0241%', '13.0663%']"
Zweigelt Niederösterreich Sandstein Pfaffl,Österreich,2023,12.50,3.6,904,"['41.3113%', '49.1872%', '1.44597%', '61.9814%']"
Aargau AOC Blauburgunder Falkenkönig Weinkeller zum Stauffacher,Schweiz,2021,9.95,3.5,711,"['0px', '17.5846%', '18.8037%', '56.1499%']"
Bordeaux Chateau Les Riganes Kosher,Herzog,,17.50,3.7,825,"['58.6964%', '45.2623%', '1.22409%', '60.3159%']"
Brunello di Montalcino DOCG Castel Giocondo,Italien,2018,57.00,4.3,59818,"['48.4157%', '57.4055%', '6.65578%', '64.1591%']"
Château Belgrave Haut-Médoc AOC Grand Cru Classé,Frankreich,2021,19.95,4.0,16952,None
Château Poujeaux Moulis-en-Médoc AOC,Frankreich,2016,44.95,4.0,22535,None
Chianti DOCG Borgovecchio,Italien,2020,15.95,3.3,81,"['42.5%', '67.5%', '0px', '67.9239%']"
Crozes-Hermitage AOP Les Moniers M. Chapoutier,Frankreich,2021,19.95,3.6,1463,"['64.442%', '50.7741%', '4.58333%', '48.7334%']"
Della Robbia Brunello di Montalcino DOCG,Italien,2016,12.95,3.6,3075,"['45.002%', '59.9685%', '17.8452%', '61.5488%']"
Etna DOC Vulkà Rosso Nicosia,Italien,2020,14.50,3.6,1956,"['67.8565%', '42.7498%', '18.9801%', '42.4221%']"
Genève AOC Assemblage Noir Divin Domaine du Paradis,Schweiz,2022,20.95,3.8,480,None
Ladoix 1er Cru Le Bois Roussot,Frankreich,2022,33.50,4.0,436,"['34.7529%', '23.5916%', '3.06452%', '61.1342%']"
Les Dailles Dôle de Salquenen AOC,Schweiz,2021,7.50,3.4,1997,"['12.5218%', '20.739%', '5.98163%', '73.4153%']"
Montsant DO Tinto Acústic Celler,Spanien,2019,15.95,3.9,8840,None
Naturaplan Bio Parco Marano Castel del Monte DOC,Italien,2016,18.50,3.8,495,"['71.0965%', '48.7805%', '23.9219%', '29.9708%']"
Ribera del Duero DO Aalto PS Bodegas y Viñedos Aalto,Spanien,2019,109.00,4.3,848,"['70.0539%', '54.8187%', '14.3124%', '53.9868%']"
Ribera del Duero DO Crianza Pesquera,Spanien,2020,18.70,4.0,60625,None
Rosso di Montalcino DOC Pian delle Vigne,Italien,2020,21.50,3.9,11541,None
Salento IGT Negroamaro Vecchia Torre,Italien,2019,9.95,3.8,2333,"['74.6392%', '34.5959%', '33.2198%', '31.0698%']"
Steinböckler Pinot Noir Malans AOC,Schweiz,2022,18.95,3.5,790,"['12.2495%', '20.136%', '11.4887%', '64.0688%']"
Ticino DOC Merlot Riserva Cagi,Schweiz,2021,9.95,3.5,574,"['61.9539%', '35.9059%', '5.91842%', '45.398%']"
Ticino DOC Selezione d'Ottobre Riserva,Schweiz,2020,19.95,3.7,63,"['53.55%', '35.2286%', '15.4071%', '39.0643%']"
Toscana IGT Saffredi Fattoria le Pupille,Italien,2020,94.50,4.4,11591,None
USA Unshackled Red Blend,USA,2019,24.95,4.0,8227,"['82.1463%', '49.4617%', '13.2219%', '58.1186%']"
