Name,Land,Jahr,Preis,Bewertung,Anzahl Bewertungen,In Aktion,Farbe,Leicht / Üppig,Sanft / Tanninhaltig,Trocken / Süss,Weich / Säurehaltig,Preis/Rating,Rating/Preis,Robert Parker
Sangiovese di Romagna DOC Appassimento Galante,Italien,2022,9.95,4,62,0,R,67.5,43.4,8.5,19,2.4875,0.40201005,Keine Punktzahl
Sannio DOC Fiano La Fortezza,Italien,2019,14.5,3.6,272,0,W,50.4924,8.40909,36.5205,,4.027777778,0.248275862,92.8
Sannio DOC Greco La Fortezza,Italien,2020,14.5,3.7,258,0,W,63.6443,2.46503,33.2902,,3.918918919,0.255172414,90.5
Santa Ana Malbec Mendoza Reserve,Argentinien,2021,9.95,3.2,89,0,R,67.5,42.5,36.25,55,3.109375,0.32160804,Keine Punktzahl
Santenay AOC Domaine Fran√ßoise & Denis Clair,Frankreich,2021,22.95,3.8,443,0,R,33.3078,24.7725,6.60341,64.6995,6.039473684,0.165577342,88.5
Sardinien DOC Argiolas Monica Superiore Iselis,Italien,2019,24.5,4,2612,0,R,76.024,43.9693,26.7657,30.6692,6.125,0.163265306,93.3
Sauvignon Blanc California Joel Gott,USA,2022,13.95,3.7,16399,0,W,42.4533,1.91918,66.3056,,3.77027027,0.265232975,Keine Punktzahl
Sauvignon blanc Fumé Pfalz Katrin Wind,Deutschland,2021,19.95,3.9,110,0,W,27.6471,0,77.5147,,5.115384615,0.195488722,95.5
Sauvignon blanc Fumé Pfalz Katrin Wind,Deutschland,2022,19.95,3.9,110,0,W,27.6471,0,77.5147,,5.115384615,0.195488722,Keine Punktzahl
Sauvignon blanc Leo Hillinger,Österreich,2022,16.9,3.8,416,0,W,22.4027,0,69.2056,,4.447368421,0.224852071,Keine Punktzahl
Sauvignon Blanc Marlborough New Zealand Matua,Neuseeland,2022,14.95,3.8,320,0,W,32.554,5.90854,72.4329,,3.934210526,0.254180602,Keine Punktzahl
Sauvignon Blanc Marlborough New Zealand Paddle Creek,Neuseeland,2022,6.9,4.3,17225,1,W,29.9815,8.066,72.5517,,1.604651163,0.623188406,Keine Punktzahl
Sauvignon Blanc Marlborough New Zealand Paddle Creek,Neuseeland,2022,6.95,4.3,17225,1,W,29.9815,8.066,72.5517,,1.61627907,0.618705036,Keine Punktzahl
Sauvignon Blanc Napa Valley Black Stallion,USA,2022,19.95,3.8,1017,0,W,44.4537,1.9191,68.2584,,5.25,0.19047619,Keine Punktzahl
Sauvignon Blanc Napa Valley Black Stallion,USA,2021,19.95,3.8,1017,0,W,44.4537,1.9191,68.2584,,5.25,0.19047619,Keine Punktzahl
Sauvignon Blanc Slavonija Kroatien Galic,Kroatien,2022,19.5,4.1,1556,0,W,21.4897,13.0148,67.3967,,4.756097561,0.21025641,Keine Punktzahl
Sauvignon Blanc Slavonija Kroatien Galic,Kroatien,2021,19.5,4.1,1556,0,W,21.4897,13.0148,67.3967,,4.756097561,0.21025641,Keine Punktzahl
Savigny-les-Beaune AOC Albert Bichot,Frankreich,2020,20.6,3.8,1467,1,R,29.7332,22.5397,1.46166,67.0109,5.421052632,0.184466019,93.5
Schaffhausen AOC Blauburgunder Hallauer Weinkeller zum Stauffacher,Schweiz,2022,3.5,3.5,711,0,R,0,17.5846,18.8037,56.1499,1,1,Keine Punktzahl
Schaffhausen AOC Blauburgunder Wilchinger,Schweiz,2022,6.7,3.4,190,1,R,9.89015,21.142,11.5379,73.4508,1.970588235,0.507462687,Keine Punktzahl
Schaffhausen AOC Chardonnay Lindengelb Weingut Lindenhof,Schweiz,2021,23.95,4,54,0,W,58.2874,0,57.0561,,5.9875,0.167014614,Keine Punktzahl
Schaffhausen AOC Chardonnay Lindengelb Weingut Lindenhof,Schweiz,2022,23.95,4,54,0,W,58.2874,0,57.0561,,5.9875,0.167014614,Keine Punktzahl
Schaffhausen AOC Hallauer Pinot Noir Sommerglut,Schweiz,2018,14.5,3.3,399,0,R,0,23.0543,0,70.6779,4.393939394,0.227586207,Keine Punktzahl
Schaffhausen AOC Hallauer Pinot Noir Spätlese Graf von Spiegelberg,Schweiz,2021,16.5,3.4,287,0,R,12.8847,32.5704,0,65.5973,4.852941176,0.206060606,Keine Punktzahl
Schaffhausen AOC Lindenhof,Schweiz,2022,17.95,4.1,190,0,W,24.9657,31.5026,8.78742,69.6112,4.37804878,0.228412256,Keine Punktzahl
Schaffhausen AOC Pinot Noir Lindenhof,Schweiz,2020,24.95,3.8,61,0,R,22.7149,31.2061,12.0482,57.7368,6.565789474,0.152304609,Keine Punktzahl
Sforzato di Valtellina DOCG Casa Vinicola Pietro Nera,Italien,2017,44.5,4.1,2275,0,R,67.6026,68.1523,12.4937,65.425,10.85365854,0.092134831,88.5
Sforzato di Valtellina DOCG San Domenico Triacca,Italien,2018,29.5,4,2661,0,R,65.0643,75.1356,16.4186,78.6079,7.375,0.13559322,90.5
Shiraz Angels Share McLaren Vale Two Hands,Australien,2019,27.5,4,23353,0,R,85,45.9309,20.0915,44.1853,6.875,0.145454545,92.2
Shiraz Angels Share McLaren Vale Two Hands,Australien,2017,27.5,4,23353,0,R,85,45.9309,20.0915,44.1853,6.875,0.145454545,89.2
Shiraz Australia Kangaroo Ridge,Australien,2022,8.95,3.2,735,0,R,85,48.1045,12.2579,41.2492,2.796875,0.357541899,Keine Punktzahl
Shiraz Barossa Valley Château Tanunda Grand Barossa,Australien,2021,19.95,3.9,15866,0,R,84.7246,44.5632,16.9087,42.3195,5.115384615,0.195488722,94.4
Shiraz Barossa Valley Château Tanunda Grand Barossa,Australien,2020,19.95,3.9,15866,0,R,84.7246,44.5632,16.9087,42.3195,5.115384615,0.195488722,93.2
Shiraz Barossa Valley VSV Hearnden Peter Lehmann,Australien,2016,36.95,4.1,425,0,R,85,46.6028,19.5014,40.1967,9.012195122,0.110960758,91
Shiraz Cabernet Australia St. Henri Penfolds,Australien,2020,119,4.4,130,0,R,79.4138,34.8733,13.5648,32.2095,27.04545455,0.03697479,93.2
Shiraz Cabernet South Australia Maxs Penfolds,Australien,2020,21.5,3.9,10189,0,R,85,48.1356,8.14741,44.1676,5.512820513,0.181395349,93.2
Shiraz Cabernet South Eastern Australia Jacobs Creek,Australien,2021,11.5,3.4,28201,0,R,84.9498,45.7521,6.77391,43.4746,3.382352941,0.295652174,94.4
Shiraz Cabernet South Eastern Australia Jacobs Creek,Australien,2020,7.95,3.4,28201,0,R,84.9498,45.7521,6.77391,43.4746,2.338235294,0.427672956,93.2
Shiraz California Penfolds Bin 600,USA,2019,65,4.3,1726,0,R,85,56.3241,10.2445,60.7706,15.11627907,0.066153846,94.5
Shiraz Coonawarra Wynns Estate,Australien,2019,8.75,3.6,7533,1,R,80.9473,44.566,17.0764,42.6277,2.430555556,0.411428571,92.2
Shiraz Grenache Mataro Penfolds Bin 138,Australien,2020,37.95,3.9,710,0,R,85,46.7448,12.6968,43.2755,9.730769231,0.102766798,93.2
Shiraz Kalimna Barossa Valley Australia Bin 28 Penfolds,Australien,2021,38.95,4.4,72,0,R,85,44.345,20.0971,42.5,8.852272727,0.11296534,94.4
Shiraz Penfolds Magill Estate,Australien,2011,185,4.4,2703,0,R,79.5753,45.2869,17.5697,44.0776,42.04545455,0.023783784,84.6
Shiraz South Australia Marananga Penfolds Bin 150,Australien,2020,69,4.3,2886,0,R,85,46.9711,11.8391,42.9607,16.04651163,0.062318841,93.2
Shiraz South Australia Penfolds St Henri,Australien,2018,125,4.4,18726,0,R,82.6971,44.9372,16.3509,42.8238,28.40909091,0.0352,94.6
Shiraz South East Australia Yellow Tail Casella Family,Australien,2022,8.5,3.5,55200,0,R,84.167,45.0069,24.9197,42.5195,2.428571429,0.411764706,Keine Punktzahl
Shiraz/Cabernet Sauvignon Australia Bin 389 Penfolds,Australien,2019,74.95,4.3,38554,0,R,85,46.9711,11.8391,42.9607,17.43023256,0.057371581,92.2
Shiraz/Cabernet Sauvignon Australia Koonunga Hill Penfolds,Australien,2020,15.95,3.7,55278,0,R,85,48.1416,10.0252,44.7091,4.310810811,0.231974922,93.2
Shiraz/Cabernet Sauvignon Koonunga Hill Penfolds,Australien,2021,9.95,3.7,55278,0,R,85,48.1416,10.0252,44.7091,2.689189189,0.371859296,94.4
Shiraz/Cabernet Sauvignon Koonunga Hill Penfolds,Australien,2019,9.95,3.7,55278,0,R,85,48.1416,10.0252,44.7091,2.689189189,0.371859296,92.2
Sicilia Contea de Sclafani DOC Rosso del Conte Tenuta Regaleali,Italien,2016,52,4.2,6290,0,R,79.0959,44.0006,24.4111,33.9634,12.38095238,0.080769231,95.4
Sicilia DOC Bio Pietre a Purtedda da Ginestra Centopassi - Libera Terra,Italien,2019,24.5,3.8,1119,0,R,39.8216,10.2635,44.9108,,6.447368421,0.155102041,93.3
Sicilia DOC Cabernet Sauvignon Butera,Italien,2016,17.5,3.5,25199,0,R,62.748,55.3136,10.3612,59.7482,5,0.2,95.4
Sicilia DOC Cabernet Sauvignon Butera,Italien,2021,17.5,3.5,25199,0,R,62.748,55.3136,10.3612,59.7482,5,0.2,Keine Punktzahl
Sicilia DOC Chardonnay Grillo Pasqua,Italien,2022,9.9,3.6,418,0,W,51.4095,0.740798,28.8129,,2.75,0.363636364,Keine Punktzahl
Sicilia DOC Grillo Cardilla Bacaro,Italien,2022,7.95,3.7,143,0,W,67.3106,0,34.947,,2.148648649,0.465408805,Keine Punktzahl
Sicilia DOC Nero Avola/Shiraz Pasqua,Italien,2021,9.9,3.6,868,0,R,72.4029,41.1123,22.0245,30.4944,2.75,0.363636364,Keine Punktzahl
Sicilia DOC Nero dAvola Cardilla,Italien,2022,8.5,3.7,1499,0,R,49.2901,39.168,38.9375,41.6522,2.297297297,0.435294118,Keine Punktzahl
Sicilia DOC Nero dAvola Cartagho Mandrarossa,Italien,2018,23.5,3.6,2858,0,R,80.6377,37.9822,24.6857,28.3881,6.527777778,0.153191489,90.5
Sicilia DOC Nero dAvola Costadune Mandrarossa,Italien,2021,11.5,3.6,4386,0,R,74.67,36.7479,27.5572,30.7321,3.194444444,0.313043478,Keine Punktzahl
Sicilia DOC Nero dAvola Nenè Fondo Antico,Italien,2021,17.5,3.9,529,0,R,77.4441,39.1848,15.6767,32.6492,4.487179487,0.222857143,Keine Punktzahl
Sicilia DOC Nero dAvola Nenè Fondo Antico,Italien,2020,17.5,3.9,529,0,R,77.4441,39.1848,15.6767,32.6492,4.487179487,0.222857143,89.8
Sicilia DOC Nero dAvola Passimora,Italien,2021,11.95,4,571,0,R,78.0277,41.1705,28.9435,34.5357,2.9875,0.334728033,Keine Punktzahl
Sicilia DOC Noto Rosso Zisola Mazzei,Italien,2020,19.5,3.8,12240,0,R,76.5154,41.0085,25.391,32.8877,5.131578947,0.194871795,89.8
Sicilia DOC Noto Rosso Zisola Mazzei,Italien,2021,19.5,3.8,12240,0,R,76.5154,41.0085,25.391,32.8877,5.131578947,0.194871795,Keine Punktzahl
Sicilia DOC Sauvignon Blanc Urra di Mare Mandrarossa,Italien,2022,18.5,3.8,3470,0,W,57.1308,7.18465,44.2748,,4.868421053,0.205405405,Keine Punktzahl
Sicilia DOC Sauvignon Blanc Urra di Mare Mandrarossa,Italien,2021,18.5,3.8,3470,0,W,57.1308,7.18465,44.2748,,4.868421053,0.205405405,94
Sicilia DOC Superiore Giato Bianco Centopassi - Libera Terra Bio Suisse,Italien,2022,13.95,3.7,842,0,W,56.5947,13.008,45.5991,,3.77027027,0.265232975,Keine Punktzahl
Sicilia DOC Superiore Giato Nero dAvola-Perricone Centopassi - Libera Terra Bio Suisse,Italien,2022,14.5,3.6,993,0,R,69.9442,39.6094,19.2107,34.7497,4.027777778,0.248275862,Keine Punktzahl
Sicilia DOC Syrah Mandrarossa,Italien,2020,11.5,3.5,1596,0,R,74.8825,39.3644,22.2107,29.6358,3.285714286,0.304347826,89.8
Sicilia IGT Nero dAvola Bromeus,Italien,2021,7.95,3.8,6021,0,R,79.2048,38.8506,36.0907,25.4391,2.092105263,0.477987421,Keine Punktzahl
Sicilia IGT Rosso Corvo,Italien,2021,8.95,3.5,22910,0,R,70.8221,39.5235,28.7587,32.0204,2.557142857,0.391061453,Keine Punktzahl
Sizilien IGT Feudi Principi di Butera Symposio,Italien,2012,33,3.9,836,0,W,81.5053,44.1028,31.0034,28.2002,8.461538462,0.118181818,88.4
Slow Food Bio Wagram DAC Roter Veltliner Wimmer-Czerny,Österreich,2021,19.95,3.7,493,0,W,20.8895,21.3647,85,,5.391891892,0.185463659,95
Slow Food Bio Wagram DAC Roter Veltliner Wimmer-Czerny,Österreich,2023,19.95,3.7,493,0,W,20.8895,21.3647,85,,5.391891892,0.185463659,Keine Punktzahl
Soave DOC Garganega Sereole Bertani,Italien,2021,14.5,3.7,2732,0,W,31.5629,6.51073,55.7068,,3.918918919,0.255172414,94
Soave DOC Garganega Sereole Bertani,Italien,2022,14.5,3.7,2732,0,W,31.5629,6.51073,55.7068,,3.918918919,0.255172414,Keine Punktzahl
Soave DOC Garganega Vintage Bertani,Italien,2020,16.5,3.8,2747,0,W,33.3505,6.21525,56.2914,,4.342105263,0.23030303,90.5
Soave DOC Garganega Vintage Bertani,Italien,2019,16.5,3.8,2747,0,W,33.3505,6.21525,56.2914,,4.342105263,0.23030303,92.8
Soave Superiore DOCG Colbaraca Masi,Italien,2021,18.5,3.7,625,0,W,37.7849,4.77524,59.5024,,5,0.2,94
Somontano DO Chardonnay 234 Enate,Spanien,2022,13.95,3.9,17975,0,W,45.5663,10.8925,46.6427,,3.576923077,0.279569892,Keine Punktzahl
Somontano DO Chardonnay 234 Enate,Spanien,2023,13.95,3.9,17978,0,W,45.5663,10.8925,46.6427,,3.576923077,0.279569892,Keine Punktzahl
South Australia Cabernet Shiraz BIN 389 Penfolds,Australien,2021,69.95,4.3,38548,0,R,85,46.9711,11.8391,42.9607,16.26744186,0.06147248,94.4
Spätburgunder Baden Alte Reben Weingut Michel,Deutschland,2021,14.95,3.7,414,0,R,6.54815,20.2138,0,73.5127,4.040540541,0.247491639,Keine Punktzahl
Spätburgunder Baden Alte Reben Weingut Michel,Deutschland,2020,14.95,3.7,414,0,R,6.54815,20.2138,0,73.5127,4.040540541,0.247491639,93
Spätburgunder Hochheim Stein erste Lage Weingut Künstler,Deutschland,2014,39.5,4.1,303,0,R,24.1607,25.5147,10.8268,66.4082,9.634146341,0.103797468,90
Spätburgunder Hochheim Stein erste Lage Weingut Künstler,Deutschland,2019,39.5,4.1,303,0,R,24.1607,25.5147,10.8268,66.4082,9.634146341,0.103797468,95
Spätburgunder Tradition Weingut Künstler,Deutschland,2020,23.7,3.6,951,0,R,4.9923,25.4247,5.53174,73.6022,6.583333333,0.151898734,93
St-Estèphe AOC Château Tour de Pez,Frankreich,2016,23.95,3.8,5813,0,R,74.3176,74.753,7.38039,72.8931,6.302631579,0.158663883,94.1
St. Laurent Niederösterreich Wald Pfaffl,Österreich,2021,12.5,3.8,480,0,R,41.2478,18.4238,31.1583,70.5999,3.289473684,0.304,Keine Punktzahl
St. Saphorin Testuz Roche Ronde Lavaux AOC,Schweiz,2021,18.5,3.5,232,0,W,32.5271,5.71544,68.2523,,5.285714286,0.189189189,Keine Punktzahl
Steinböckler Pinot Noir Malans AOC,Schweiz,2022,18.95,3.5,790,0,R,12.2495,20.136,11.4887,64.0688,5.414285714,0.18469657,Keine Punktzahl
Steinert Flaxmans Eden Valley Shiraz Powell & Son,Australien,2016,374.25,4.4,291,0,R,82.4911,44.2799,17.5212,42.6635,85.05681818,0.011756847,91
Südsteiermark DAC Chardonnay Illyr Marienkreuz Muster.Gamlitz,Österreich,2020,16.95,3.7,205,0,W,43.2894,7.03125,52.9878,,4.581081081,0.218289086,93.5
Südsteiermark DAC Chardonnay Marienkreuz Muster.Gamlitz,Österreich,2021,16.95,3.7,205,0,W,43.2894,7.03125,52.9878,,4.581081081,0.218289086,95
Südsteiermark DAC Gelber Muskateller Illyr Reinhard Muster,Österreich,2022,19.95,3.7,193,0,W,17.3113,16.7642,85,,5.391891892,0.185463659,Keine Punktzahl
Südsteiermark DAC Sauvignon Blanc Reverenz Muster.Gamlitz,Österreich,2021,23.5,3.9,363,0,W,31.9846,8.99369,61.295,,6.025641026,0.165957447,95
Südsteiermark DAC Sauvignon Blanc Reverenz Muster.Gamlitz,Österreich,2022,23.5,3.9,363,0,W,31.9846,8.99369,61.295,,6.025641026,0.165957447,Keine Punktzahl
Südsteiermark DAC Welschriesling Retro Muster.Gamlitz,Österreich,2022,7.95,3.3,393,0,W,26.2063,12.5437,83.2745,,2.409090909,0.41509434,Keine Punktzahl
Südtirol DOC Chardonnay Merus Tiefenbrunner Schlosskellerei Turmhof,Italien,2020,24.5,3.8,829,0,W,56.4288,21.1212,52.7836,,6.447368421,0.155102041,90.5
Südtirol DOC Gewürztraminer Merus Tiefenbrunner Schlosskellerei Turmhof,Italien,2022,21.5,4.1,1711,0,W,63.1861,38.0437,26.6052,,5.243902439,0.190697674,Keine Punktzahl
Südtirol DOC Lagrein Alto Adige Collection KG Gries Baron Eyrl,Italien,2022,15.5,3.9,3013,0,R,60.4402,40.6391,15.8141,29.4184,3.974358974,0.251612903,Keine Punktzahl
Südtirol DOC Lagrein Riserva Linticlarus Tiefenbrunner Schlosskellerei Turmhof,Italien,2019,49.5,4.2,1537,0,R,65.7358,40.9529,23.8174,29.9412,11.78571429,0.084848485,93.3
Südtirol DOC Lagrein Tiefenbrunner Schlosskellerei Turmhof,Italien,2021,27.95,4,3144,0,R,61.1717,38.0758,19.0029,37.4082,6.9875,0.143112701,Keine Punktzahl
Südtirol DOC Merus Tiefenbrunner Schlosskellerei Turmhof,Italien,2020,22.9,4,3144,0,R,61.1717,38.0758,19.0029,37.4082,5.725,0.174672489,89.8
Südtirol DOC Pinot Grigio Merus Tiefenbrunner Schlosskellerei Turmhof,Italien,2022,24.5,3.9,1343,0,W,43.1878,8.69082,39.2967,,6.282051282,0.159183673,Keine Punktzahl
Südtirol DOC Sauvignon Alto Adige Collection KG Gries Graf Huyn,Italien,2023,15.5,4,1179,0,W,59.2102,28.6759,57.2276,,3.875,0.258064516,Keine Punktzahl
Südtirol DOC Sauvignon Blanc Merus Tiefenbrunner Schlosskellerei Turmhof,Italien,2021,20.9,3.9,614,0,W,58.0492,17.2861,51.7518,,5.358974359,0.186602871,94
Taurasi DOCG Aglianico Marziacanale Vinosia,Italien,2015,29.5,4.1,1716,0,R,79.9587,51.5404,19.9484,33.0529,7.195121951,0.138983051,93.6
Taurasi Riserva DOCG Rajamagra Vinosia,Italien,2015,34.5,4.2,1558,0,R,81.3086,45.6077,26.5625,27.9937,8.214285714,0.12173913,93.6
Teneriffa Artífice Listan Blanco Borja Pérez Viticultor,Spanien,2020,25,3.9,859,0,W,26.846,10.1358,80.0617,,6.41025641,0.156,93.2
Teneriffa Artífice Vidueños Blanco Borja Pérez Viticultor Vidueños,Spanien,2020,29,3.9,541,0,W,20.5881,10.2968,81.4191,,7.435897436,0.134482759,93.2
Teneriffa DO Ignios Orígenes Listan Negro Borja Pérez Viticultor,Spanien,2016,24.5,3.8,464,0,R,51.7951,35.7074,9.42441,51.3784,6.447368421,0.155102041,93.8
Teneriffa Listan Blanco Borja Pérez Viticultor Llanito Perera,Spanien,2020,34,4,233,0,W,23.4509,12.067,80.7087,,8.5,0.117647059,93.2
Tenuta Montalbano Merlot Ticino DOC,Schweiz,2020,16.95,3.3,274,0,R,54.5762,39.4695,0,46.0787,5.136363636,0.194690265,Keine Punktzahl
Teran Hrvatska Istra Marko Fakin,Kroatien,2022,15.95,4,433,0,R,64.0635,44.0331,3.69048,45.9775,3.9875,0.250783699,Keine Punktzahl
Teroldego Rotaliano DOC Bottega Vinai Cavit,Italien,2021,13.95,3.6,1424,0,R,55.6701,40.0528,14.9564,31.1873,3.875,0.258064516,Keine Punktzahl
Terre di Chieti IGT Leggermente Appassite Patroferno,Italien,2021,13.5,4.2,25,0,R,44.6395,37.6861,0,35.5465,3.214285714,0.311111111,Keine Punktzahl
Terre Domiziane DOC Rosso Roma,Italien,2019,14.95,3.7,27,0,R,59.3677,49.6324,17.8677,53.3088,4.040540541,0.247491639,93.3
Terre Siciliane IGP Tripudium Cantine Pellegrino,Italien,2021,11.7,3.7,2126,1,R,77.811,41.9123,26.0062,35.2102,3.162162162,0.316239316,Keine Punktzahl
Terre Siciliane IGT Catarratto Terre Rosse di Giabbascio Centopassi - Libera Terra Bio,Italien,2022,16.5,3.7,639,0,W,56.6986,3.65386,38.4586,,4.459459459,0.224242424,Keine Punktzahl
Terre Siciliane IGT Cavadiserpe Mandrarossa,Italien,2019,19.5,3.8,1998,0,R,79.1485,44.0051,23.677,34.7455,5.131578947,0.194871795,93.3
Terre Siciliane IGT Due Lune,Italien,2021,14.7,4.2,18079,1,R,80.8144,38.073,39.1471,25.4701,3.5,0.285714286,Keine Punktzahl
Terre Siciliane IGT I Versi Bianco Fondo Antico,Italien,2022,9.5,3.5,608,0,W,56.6493,3.17557,43.5878,,2.714285714,0.368421053,Keine Punktzahl
Terre Siciliane IGT Malbec Gazzerotta Cantine Pellegrino,Italien,2020,14.5,4,231,0,R,79.9592,45.7984,26.7037,33.0417,3.625,0.275862069,89.8
Terre Siciliane IGT Nero dAvola Bromeus,Italien,2022,9.5,3.8,6021,1,R,79.2048,38.8506,36.0907,25.4391,2.5,0.4,Keine Punktzahl
Terre Siciliane IGT Nero dAvola Riserva Corvo Duca di Salaparuta,Italien,2020,12.95,3.8,7051,0,R,75.3488,43.6779,27.8557,33.3478,3.407894737,0.293436293,89.8
Terre Siciliane IGT Passimiento,Italien,2021,13.5,4.1,16963,0,R,83.1949,31.295,39.1186,20.2578,3.292682927,0.303703704,Keine Punktzahl
Terre Siciliane IGT Passimiento,Italien,2022,13.5,4.1,16967,0,R,83.1949,31.295,39.1186,20.2578,3.292682927,0.303703704,Keine Punktzahl
Terre Siciliane IGT Santannella Mandrarossa,Italien,2021,20.5,3.8,1067,0,W,65.8727,12.3504,34.2143,,5.394736842,0.185365854,94
The Prisoner Napa Valley,USA,2019,72,4.4,9335,0,R,82.5713,49.1236,12.383,49.0816,16.36363636,0.061111111,94.5
Three Graces Barossa Valley Australia Château Tanunda,Australien,2021,7.45,3.8,96,1,R,80,55,5,42.5,1.960526316,0.510067114,94.4
Thurgau AOC Iselisberger Blauburgunder,Schweiz,2022,9.95,3,27,0,R,14.5175,36.7105,10.0439,70.5702,3.316666667,0.301507538,Keine Punktzahl
Ticino DOC Bianco di Merlot Passo di Tambo Vini Tamborini,Schweiz,2022,19.95,3.9,562,0,W,61.9282,36.9085,15.0478,50.2476,5.115384615,0.195488722,Keine Punktzahl
Ticino DOC Carato Merlot Vini e Distillati Angelo Delea,Schweiz,2020,36,4.1,2100,0,R,62.2259,36.5833,11.0304,41.1104,8.780487805,0.113888889,Keine Punktzahl
Ticino DOC Johanniter Riserva Cantina Giubiasco,Schweiz,2021,18.7,3.5,574,1,W,61.9539,35.9059,5.91842,45.398,5.342857143,0.187165775,Keine Punktzahl
Ticino DOC Merlot Amaranto VITI,Schweiz,2020,12.95,3.3,207,0,R,49.4799,35.4128,6.63423,43.4614,3.924242424,0.254826255,Keine Punktzahl
Ticino DOC Merlot Amaranto VITI,Schweiz,2021,12.95,3.3,207,0,R,49.4799,35.4128,6.63423,43.4614,3.924242424,0.254826255,Keine Punktzahl
Ticino DOC Merlot Ampelio Carlevaro,Schweiz,2018,33,2.3,11,0,R,67.5,42.5,0,42.5,14.34782609,0.06969697,Keine Punktzahl
Ticino DOC Merlot Arcangelo Riserva Tamborini,Schweiz,2020,25,3.7,80,0,R,58.1034,44.1193,25.8886,45.0886,6.756756757,0.148,Keine Punktzahl
Ticino DOC Merlot Arcangelo Riserva Tamborini 2017,Schweiz,2019,25,3.7,65,0,R,58.1034,44.1193,25.8886,45.0886,6.756756757,0.148,Keine Punktzahl
Ticino DOC Merlot Baiocco,Schweiz,2021,17.95,3.7,2689,0,R,59.5235,39.9061,2.5204,40.4492,4.851351351,0.206128134,Keine Punktzahl
Ticino DOC Merlot Barbarossa Riserva,Schweiz,2019,23.5,3.7,537,0,R,51.1275,49.9858,23.5844,50.9194,6.351351351,0.157446809,Keine Punktzahl
Ticino DOC Merlot Biasca Premium,Schweiz,2021,21.95,3.7,1375,0,R,62.1212,39.1915,7.96057,45.2622,5.932432432,0.16856492,Keine Punktzahl
Ticino DOC Merlot Biasca Premium,Schweiz,2020,21.95,3.7,1375,0,R,62.1212,39.1915,7.96057,45.2622,5.932432432,0.16856492,Keine Punktzahl
Ticino DOC Merlot Cannaiola Terreni alla Maggia,Schweiz,2020,15.15,3.7,537,1,R,51.1275,49.9858,23.5844,50.9194,4.094594595,0.244224422,Keine Punktzahl
Ticino DOC Merlot Collivo,Schweiz,2021,13.95,3.5,564,0,R,47.9948,40.0629,22.0918,50.653,3.985714286,0.250896057,Keine Punktzahl
Ticino DOC Merlot Collivo Riserva,Schweiz,2020,21.5,3.8,689,0,R,56.4886,42.9226,9.75437,49.2649,5.657894737,0.176744186,Keine Punktzahl
Ticino DOC Merlot Cuvée Speciale Valsangiacomo,Schweiz,2019,22,3.7,262,0,R,61.0043,34.615,14.9057,33.2102,5.945945946,0.168181818,Keine Punktzahl
Ticino DOC Merlot Gambarogno,Schweiz,2021,19.5,3.6,178,0,R,51.9766,33.5039,20.4961,44.9453,5.416666667,0.184615385,Keine Punktzahl
Ticino DOC Merlot Gambarogno,Schweiz,2022,19.5,3.6,178,0,R,51.9766,33.5039,20.4961,44.9453,5.416666667,0.184615385,Keine Punktzahl
Ticino DOC Merlot Genestrerio Tenimento dellÖr,Schweiz,2020,22.5,3.5,535,0,R,57.945,40.2958,12.0576,45.3824,6.428571429,0.155555556,Keine Punktzahl
Ticino DOC Merlot Giornico Oro Gialdi Vini,Schweiz,2021,24.95,3.8,2008,0,R,59.6022,37.8034,17.0947,45.5666,6.565789474,0.152304609,Keine Punktzahl
Ticino DOC Merlot Gudo Delea,Schweiz,2021,17.5,3.5,310,0,R,60.9043,46.8343,4.10503,48.186,5,0.2,Keine Punktzahl
Ticino DOC Merlot Gudo Delea,Schweiz,2022,17.5,3.5,310,0,R,60.9043,46.8343,4.10503,48.186,5,0.2,Keine Punktzahl
Ticino DOC Merlot Il Giubileo Terreni alla Maggia,Schweiz,2019,26.95,4,327,0,R,59.6613,46.9228,17.8514,49.083,6.7375,0.148423006,Keine Punktzahl
Ticino DOC Merlot lAriete Valsangiacomo,Schweiz,2019,11.6,3.3,472,1,R,62.3024,45.8306,0.57481,48.2973,3.515151515,0.284482759,Keine Punktzahl
Ticino DOC Merlot LAriete Valsangiacomo,Schweiz,2022,15.5,3.3,472,1,R,62.3024,45.8306,0.57481,48.2973,4.696969697,0.212903226,Keine Punktzahl
Ticino DOC Merlot Ligornetto,Schweiz,2021,46.5,4.2,3132,0,R,59.8601,39.3044,12.4251,46.933,11.07142857,0.090322581,Keine Punktzahl
Ticino DOC Merlot Marca Oro Cantina Sociale Mendrisio,Schweiz,2021,11.5,3.3,248,0,R,64.604,46.0495,0.787133,50.2908,3.484848485,0.286956522,Keine Punktzahl
Ticino DOC Merlot Merlino,Schweiz,2019,14.95,3.7,381,0,R,50.8096,36.0661,17.4249,46.3912,4.040540541,0.247491639,Keine Punktzahl
Ticino DOC Merlot Monte Carasso,Schweiz,2021,29.5,3.9,307,0,R,64.9953,46.4561,15.5525,36.6895,7.564102564,0.13220339,Keine Punktzahl
Ticino DOC Merlot Poggio Solivo,Schweiz,2018,17.5,3.4,478,0,R,60.1388,45.6977,8.26824,56.1518,5.147058824,0.194285714,Keine Punktzahl
Ticino DOC Merlot Poggio Solivo,Schweiz,2020,17.5,3.4,478,0,R,60.1388,45.6977,8.26824,56.1518,5.147058824,0.194285714,Keine Punktzahl
Ticino DOC Merlot Quattromani,Schweiz,2020,59.5,4.3,4370,0,R,62.6261,45.0879,15.003,45.7048,13.8372093,0.072268908,Keine Punktzahl
Ticino DOC Merlot Quattromani,Schweiz,2021,59.5,4.3,4370,0,R,62.6261,45.0879,15.003,45.7048,13.8372093,0.072268908,Keine Punktzahl
Ticino DOC Merlot Ramina Fumagalli,Schweiz,2020,15.95,3.3,195,0,R,58.8995,48.5335,26.6804,43.5773,4.833333333,0.206896552,Keine Punktzahl
Ticino DOC Merlot Ramina Fumagalli,Schweiz,2021,15.95,3.3,195,0,R,58.8995,48.5335,26.6804,43.5773,4.833333333,0.206896552,Keine Punktzahl
Ticino DOC Merlot Riserva Amaranto,Schweiz,2020,24.95,3.8,30,0,R,53.6835,31.8576,20.8797,44.7405,6.565789474,0.152304609,Keine Punktzahl
Ticino DOC Merlot Riserva Cagi,Schweiz,2021,9.95,3.5,574,0,R,61.9539,35.9059,5.91842,45.398,2.842857143,0.351758794,Keine Punktzahl
Ticino DOC Merlot Riserva Del Carmagnola,Schweiz,2020,26.5,3.9,295,0,R,64.1881,40.2642,5.60437,45.6044,6.794871795,0.147169811,Keine Punktzahl
Ticino DOC Merlot Riserva di Bacco,Schweiz,2019,15.95,3.8,202,0,R,44.3474,38.276,1.72727,48.1526,4.197368421,0.238244514,Keine Punktzahl
Ticino DOC Merlot Riserva Rubro Valsangiacomo,Schweiz,2019,39.5,4,582,0,R,67.4386,46.6244,11.2591,48.4437,9.875,0.101265823,Keine Punktzahl
Ticino DOC Merlot Riserva Tenuta Vitivinicola Trapletti,Schweiz,2019,32.5,3.5,417,0,R,63.5254,40.3102,5.55284,51.5357,9.285714286,0.107692308,Keine Punktzahl
Ticino DOC Merlot Roccolo,Schweiz,2020,7.95,3.5,1001,1,R,54.6854,38.7837,10.3125,47.3956,2.271428571,0.440251572,Keine Punktzahl
Ticino DOC Merlot Rompidée,Schweiz,2020,39,3.5,17560,0,R,56.0048,44.0847,14.4239,52.4211,11.14285714,0.08974359,Keine Punktzahl
Ticino DOC Merlot Ronco,Schweiz,2018,24.95,3.7,848,0,R,58.5803,39.0683,10.863,50.1805,6.743243243,0.148296593,Keine Punktzahl
Ticino DOC Merlot Roncobello Valsangiacomo,Schweiz,2020,20.95,3.6,810,0,R,56.5778,44.6994,4.22123,45.1937,5.819444444,0.171837709,Keine Punktzahl
Ticino DOC Merlot Roncobello Valsangiacomo,Schweiz,2019,20.95,3.6,810,0,R,56.5778,44.6994,4.22123,45.1937,5.819444444,0.171837709,Keine Punktzahl
Ticino DOC Merlot Runchet Tamborini,Schweiz,2020,14.5,3.3,498,0,R,47.9423,41.6677,0.631948,50.6528,4.393939394,0.227586207,Keine Punktzahl
Ticino DOC Merlot Saetta,Schweiz,2020,55,4,192,0,R,67.5226,55.6733,5.82852,52.4224,13.75,0.072727273,Keine Punktzahl
Ticino DOC Merlot Saleggi,Schweiz,2020,19.95,3.7,1176,0,R,62.2244,45.6375,0.977625,45.316,5.391891892,0.185463659,Keine Punktzahl
Ticino DOC Merlot SanZeno Classico,Schweiz,2017,23.95,3.6,701,0,R,54.9749,43.4304,21.0793,44.5292,6.652777778,0.150313152,Keine Punktzahl
Ticino DOC Merlot SanZeno Classico,Schweiz,2019,23.95,3.6,701,0,R,54.9749,43.4304,21.0793,44.5292,6.652777778,0.150313152,Keine Punktzahl
Ticino DOC Merlot Sassariente Matasci,Schweiz,2020,18.95,3.8,136,0,R,67.2138,37.5145,0,44.8333,4.986842105,0.200527704,Keine Punktzahl
