Name,Land,Jahr,Preis,Bewertung,Anzahl Bewertungen,In Aktion,Farbe,Leicht / Üppig,Sanft / Tanninhaltig,Trocken / Süss,Weich / Säurehaltig,Preis/Rating,Rating/Preis,Robert Parker
Magnum Dehesa del Carrizal DO Petit Verdot,Spanien,2016,52,4.1,1589,0,R,63.3249,47.4017,15.5256,47.7832,12.68292683,0.078846154,93.8
Magnum Douro DOC Fabelhaft Niepoort,Portugal,2019,35,3.7,18853,0,R,79.2556,53.4931,9.54613,44.9907,9.459459459,0.105714286,92
Magnum Douro DOC Reserva Quinta dos Quatro Ventos,Portugal,2019,33,4.2,1265,0,R,81.3629,52.4971,14.2174,45.1828,7.857142857,0.127272727,92
Magnum La Mancha DO Finca Antigua Crianza Único,Spanien,2016,29,3.7,766,0,R,65.7526,44.9168,8.12909,40.2106,7.837837838,0.127586207,93.8
Magnum La Mancha DO Tempranillo Crianza Finca Antigua,Spanien,2019,28,3.6,2797,0,R,75.4203,55.4589,8.55478,36.4273,7.777777778,0.128571429,93.5
Magnum Mallorca 12 Volts 4kilos vinicola,Spanien,2016,55,3.9,8742,0,R,57.084,40.3669,10.8779,45.2305,14.1025641,0.070909091,93.8
Magnum Mallorca 12 Volts 4kilos vinicola,Spanien,2018,55,3.9,8742,0,R,57.084,40.3669,10.8779,45.2305,14.1025641,0.070909091,94.5
Magnum Mallorca Callet 4kilos vinícola,Spanien,2018,115,3.6,512,0,R,30.1488,29.9225,15.5916,46.0753,31.94444444,0.031304348,94.5
Magnum Meursault 1er Cru Les Charmes,Frankreich,2023,185,4.2,914,0,W,62.3218,6.26093,48.3413,,44.04761905,0.022702703,Keine Punktzahl
Magnum Nuits-Saint-Georges 1er Cru Clos des Argillières,Frankreich,2023,149,4.1,987,0,R,42.1522,32.1884,10.6319,74.0147,36.34146341,0.027516779,Keine Punktzahl
Magnum Ribera del Duero DO Conde de San Cristóbal,Spanien,2019,49.95,3.9,14260,0,R,63.9522,50.9235,12.3634,54.4953,12.80769231,0.078078078,93.5
Magnum Rioja DOCa Reserva Marqués de Riscal,Spanien,2019,34.95,4.1,227151,0,R,63.8968,59.2479,9.3505,59.4017,8.524390244,0.117310443,93.5
Magnum Rioja Faustino I Gran Reserva DOCa Etui,Spanien,2011,49.95,4.1,92276,0,R,61.9754,58.0479,8.25273,59.6461,12.18292683,0.082082082,88.2
Magnum Rocca Guicciarda Chianti classico Riserva DOCG Ricasoli,Italien,2019,37.5,3.8,21095,0,R,45.2037,55.8096,5.96151,62.8577,9.868421053,0.101333333,93.3
Magnum Rocca Guicciarda Chianti classico Riserva DOCG Ricasoli,Italien,2020,37.5,3.8,21095,0,R,45.2037,55.8096,5.96151,62.8577,9.868421053,0.101333333,89.8
Magnum Ticino DOC Merlot Quattromani,Schweiz,2019,125,4.3,4370,0,R,62.6261,45.0879,15.003,45.7048,29.06976744,0.0344,Keine Punktzahl
Magnum Ticino DOC Merlot Quattromani,Schweiz,2020,125,4.3,4370,0,R,62.6261,45.0879,15.003,45.7048,29.06976744,0.0344,Keine Punktzahl
Magnum Toscana IGT Centine Banfi,Italien,2020,25,3.7,21939,0,R,45.3991,37.7724,6.76939,45.3874,6.756756757,0.148,89.8
Magnum Toscana IGT Guidalberto Tenuta San Guido,Italien,2020,89,4.1,57075,0,R,51.0214,41.4611,8.27209,46.3313,21.70731707,0.046067416,89.8
Magnum Toscana IGT Le Difese Tenuta San Guido,Italien,2021,49,3.8,45975,0,R,45.6358,42.5879,6.53265,48.2424,12.89473684,0.07755102,Keine Punktzahl
Magnum Toscana IGT Rosso Villa Antinori,Italien,2021,39.5,3.8,123278,0,R,47.7876,40.2676,10.0666,49.0752,10.39473684,0.096202532,Keine Punktzahl
Magnum Vacqueyras AOP Beaumirail Cave de Gigondas,Frankreich,2019,39.95,3.8,2473,0,R,66.0651,43.5182,6.27455,51.3322,10.51315789,0.095118899,94.9
Magnum Vacqueyras AOP Beaumirail Cave de Gigondas,Frankreich,2020,39.95,3.8,2473,0,R,66.0651,43.5182,6.27455,51.3322,10.51315789,0.095118899,93.5
Magnum Valais AOC Syrah Cayas Jean-René Germanier,Schweiz,2020,99.95,3.8,3061,0,R,64.5458,58.5149,8.73389,55.6124,26.30263158,0.03801901,Keine Punktzahl
Magnum Verona IGT Campofiorin Masi Agricola,Italien,2020,32.5,3.7,74701,0,R,63.9897,38.372,18.2803,27.6066,8.783783784,0.113846154,89.8
Magnum Volnay 1er Cru Clos des Chênes,Frankreich,2023,135,4.1,2351,0,R,36.7311,26.9355,3.79662,62.9729,32.92682927,0.03037037,Keine Punktzahl
Magnum Vosne-Romanée 1er Cru Les Malconsorts,Frankreich,2023,379,4.2,202,0,R,45.3039,34.8944,13.185,72.6617,90.23809524,0.011081794,Keine Punktzahl
Maison Albert Bichot Grands Echezeaux Grand Cru,Frankreich,2017,215,4.2,31,0,R,56.5341,44.0341,0,64.1506,51.19047619,0.019534884,91.7
Malans AOC Pinot Noir Weingut Von Salis,Schweiz,2022,21.5,3.9,534,0,R,4.45405,20.2554,12.753,77.628,5.512820513,0.181395349,Keine Punktzahl
Malans AOC Pinot Noir Weingut Von Salis,Schweiz,2021,21.5,3.9,534,0,R,4.45405,20.2554,12.753,77.628,5.512820513,0.181395349,Keine Punktzahl
Malanser Steinadler Pinot Noir,Schweiz,2022,13.5,3.7,170,0,R,0,15.5448,18.0542,47.6392,3.648648649,0.274074074,Keine Punktzahl
Malbec Amalaya Valle Calchaqui,Argentinien,2020,14.95,3.9,4253,0,R,84.2764,56.6742,12.5308,63.8017,3.833333333,0.260869565,Keine Punktzahl
Malbec Amalaya Valle Calchaqui,Argentinien,2022,14.95,3.9,4253,0,R,84.2764,56.6742,12.5308,63.8017,3.833333333,0.260869565,Keine Punktzahl
Malbec Argentinia Gran Reserva Finca El Origen,Argentinien,2019,17.5,3.9,2940,0,R,66.9538,29.9213,18.4692,35.2825,4.487179487,0.222857143,Keine Punktzahl
Malbec Gran Reserva Mendoza Vineyards,Argentinien,2018,17.95,3.9,9180,0,R,64.5358,25.1786,14.9646,35.1614,4.602564103,0.217270195,Keine Punktzahl
Malbec Mendoza Argentina Bodega Septima,Argentinien,2022,14.5,3.4,30540,0,R,62.0843,25.9984,18.9675,36.9385,4.264705882,0.234482759,Keine Punktzahl
Malbec Mendoza Argentina Bodega Septima,Argentinien,2021,14.5,3.4,30540,0,R,62.0843,25.9984,18.9675,36.9385,4.264705882,0.234482759,Keine Punktzahl
Malbec Ojo de Agua Dieter Meier,Argentinien,2021,19.95,4,7982,0,R,63.3303,23.6079,17.7062,34.6412,4.9875,0.200501253,Keine Punktzahl
Malbec Reserva Mendoza Argentina Alvaro,Argentinien,2022,9.9,3.6,211,1,R,57.4659,34.892,26.108,37.5549,2.75,0.363636364,Keine Punktzahl
Mallorca Callet 4Kilos Vinicola,Spanien,2019,49,3.6,512,0,R,30.1488,29.9225,15.5916,46.0753,13.61111111,0.073469388,93.5
Mallorca Can Xanet Cumas Tramuntana,Spanien,2016,45,3.8,224,0,R,54.6606,37.5135,4.21823,41.807,11.84210526,0.084444444,93.8
Mallorca Can Xanet Sibila Tramuntana,Spanien,2016,45,3.9,284,0,R,51.4933,34.647,2.72114,45.6517,11.53846154,0.086666667,93.8
Mallorca Tinto Cosecha 4kilos vinícola Gallinas y Focas,Spanien,2019,32,3.9,3244,0,R,48.9847,37.3851,17.0824,45.0501,8.205128205,0.121875,93.5
Manduria DOC Primitivo Ué Pàssula Vinosia,Italien,2017,28.5,4.3,1221,0,R,64.7325,18.9658,39.89,9.36625,6.627906977,0.150877193,88.5
Manduria DOP Primitivo Uno Riserva Masseria la Volpe,Italien,2020,19.95,4.3,3695,0,R,69.4195,26.2311,42.2514,13.4217,4.639534884,0.215538847,89.8
Marchand-Tawse Charmes-Chambertin Grand Cru,Frankreich,2017,169,4.2,178,0,R,45.6131,41.1036,8.76914,80.3349,40.23809524,0.024852071,91.7
Marche IGT Cabernet Franc Cosmino Il Pollenza,Italien,2016,27.5,4,794,0,R,55.842,48.3882,9.32721,42.9793,6.875,0.145454545,95.4
Maremma Toscana DOC Poggio alle Nane Fattoria Le Mortelle,Italien,2019,69,4.4,4331,0,R,58.1808,40.7444,15.313,42.8347,15.68181818,0.063768116,93.3
Maremma Toscana DOC Poggio alle Nane Le Mortelle,Italien,2020,69,4.4,4331,0,R,58.1808,40.7444,15.313,42.8347,15.68181818,0.063768116,89.8
Maremma Toscana DOC Poggio Bestiale Fattoria di Magliano,Italien,2018,37.5,4,3323,0,R,53.8723,45.3679,10.6521,46.0186,9.375,0.106666667,90.5
Maremma Toscana DOC Vermentino Cantina La Selva Bio,Italien,2022,18.5,3.4,67,0,W,42.0708,18.4745,55.7321,,5.441176471,0.183783784,Keine Punktzahl
Maremma Toscana DOC Vermentino Mandriano Sensi,Italien,2022,13.95,3.6,858,0,W,41.3627,23.8285,52.5372,,3.875,0.258064516,Keine Punktzahl
Maremma Toscana IGT Terre More,Italien,2020,17.5,3.8,4197,0,R,49.3566,40.9966,9.94271,44.8706,4.605263158,0.217142857,89.8
Maremma Toscana IGT Terre More,Italien,2021,17.5,3.8,4197,0,R,49.3566,40.9966,9.94271,44.8706,4.605263158,0.217142857,Keine Punktzahl
Marken DOC Brecciarolo Gold Rosso Piceno Superiore Velenosi Vini,Italien,2019,19.9,3.8,1639,0,R,59.2826,44.0783,17.9563,37.6486,5.236842105,0.190954774,93.3
Marken DOC Brecciarolo Gold Rosso Piceno Superiore Velenosi Vini,Italien,2021,19.9,3.8,1639,0,R,59.2826,44.0783,17.9563,37.6486,5.236842105,0.190954774,Keine Punktzahl
Marken DOC Brecciarolo Rosso Piceno Superiore Velenosi Vini,Italien,2018,13.5,3.7,7492,0,R,50.9354,40.6845,7.61394,46.1598,3.648648649,0.274074074,90.5
Marlborough Sauvignon Blanc Cloudy Bay,Neuseeland,2022,34.95,4.2,78657,0,W,32.4891,1.04138,78.5315,,8.321428571,0.120171674,Keine Punktzahl
Marlborough Sauvignon Blanc Te Koko Cloudy Bay,Neuseeland,2020,62.5,4.2,10423,0,W,36.0331,6.48596,77.0988,,14.88095238,0.0672,Keine Punktzahl
Marlborough Sauvignon Blanc Te Koko Cloudy Bay,Neuseeland,2019,62.5,4.2,10423,0,W,36.0331,6.48596,77.0988,,14.88095238,0.0672,91
Médoc AOC Château Laffitte Laujac,Frankreich,2021,8.95,3.6,6327,0,R,69.4879,72.8185,2.63008,73.3591,2.486111111,0.402234637,88.5
Médoc AOC Château Lousteauneuf,Frankreich,2018,16.95,3.7,2203,0,R,73.2371,73.4598,11.9125,67.0163,4.581081081,0.218289086,92.9
Médoc AOC Château Moulin de Noaillac,Frankreich,2021,6.95,3.4,1315,1,R,70.6094,64.6738,0,73.1816,2.044117647,0.489208633,88.5
Médoc AOC Cru Bourgeois Château Laffitte Laujac,Frankreich,2020,9.95,3.6,6327,1,R,69.4879,72.8185,2.63008,73.3591,2.763888889,0.361809045,93.5
Médoc AOC Cru Bourgeois Château Laffitte Laujac,Frankreich,2021,9.95,3.6,6327,1,R,69.4879,72.8185,2.63008,73.3591,2.763888889,0.361809045,88.5
Médoc AOC Trois Manoirs,Frankreich,2011,14.95,3.7,4273,0,R,72.5212,68.3738,5.2475,68.0051,4.040540541,0.247491639,89.2
Mendoza Grand Malbec Terrazas de los Andes,Argentinien,2019,49.95,3.9,1715,0,R,65.364,53.9077,10.105,43.9478,12.80769231,0.078078078,Keine Punktzahl
Mendoza Malbec Adrianna Vineyard Fortuna Terrae Catena,Argentinien,2018,89,4.5,2951,0,R,62.1667,32.751,22.129,39.4656,19.77777778,0.050561798,Keine Punktzahl
Mendoza Malbec Adrianna Vineyard Fortuna Terrae Catena,Argentinien,2019,89,4.5,2951,0,R,62.1667,32.751,22.129,39.4656,19.77777778,0.050561798,Keine Punktzahl
Mendoza Malbec Catena Alta,Argentinien,2018,45,4.3,34624,0,R,65.7718,27.5547,18.2638,34.7329,10.46511628,0.095555556,Keine Punktzahl
Mendoza Malbec Finca Decero,Argentinien,2019,24,3.7,388,0,R,65.7003,26.9439,16.3502,35.0036,6.486486486,0.154166667,Keine Punktzahl
Mendoza Malbec Terrazas de los Andes,Argentinien,2021,18.5,4.2,176,0,R,57.8014,38.0975,26.686,46.427,4.404761905,0.227027027,Keine Punktzahl
Mendoza Malbec Valles Zuccardi,Argentinien,2021,14.95,3.8,2602,0,R,58.1633,36.954,15.914,42.5499,3.934210526,0.254180602,Keine Punktzahl
Mendoza Petit Caro Bodegas Caro,Argentinien,2017,23.5,4.1,6793,0,R,69.9594,47.3991,13.1891,46.0436,5.731707317,0.174468085,Keine Punktzahl
Mendoza The Owl & The Dust Devil Icon Finca Decero,Argentinien,2018,27.9,4.2,3671,0,R,66.4924,44.4363,30.0526,55.0099,6.642857143,0.150537634,Keine Punktzahl
Mendoza The Owl & The Dust Devil Icon Finca Decero,Argentinien,2019,27.9,4.2,3671,0,R,66.4924,44.4363,30.0526,55.0099,6.642857143,0.150537634,Keine Punktzahl
Mendoza Vineyards Malbec Gran Reserva,Argentinien,2021,17.95,3.9,9180,0,R,64.5358,25.1786,14.9646,35.1614,4.602564103,0.217270195,Keine Punktzahl
Mendoza Vineyards Malbec Selección,Argentinien,2022,12.95,3.4,127,0,R,67.7944,26.8649,18.0686,28.1734,3.808823529,0.262548263,Keine Punktzahl
Menetou-Salon AOP Côtes de Morogues Fournier Père et Fils,Frankreich,2022,14.95,3.9,586,0,W,22.6724,0.755265,70.4763,,3.833333333,0.260869565,Keine Punktzahl
Mentrita DO Grenache Daniel Gómez Jiménez-Landi Las Uvas de la Ira,Spanien,2016,26.5,4,102,0,R,67.0707,40.3131,1.27778,42.8434,6.625,0.150943396,93.8
Mentrita DO Grenache Daniel Gómez Jiménez-Landi Las Uvas de la Ira,Spanien,2019,26.5,4,102,0,R,67.0707,40.3131,1.27778,42.8434,6.625,0.150943396,93.5
Mentrita DO Grenache Daniel Gómez Jiménez-Landi Las Uvas de la Ira,Spanien,2017,26.5,4,102,0,R,67.0707,40.3131,1.27778,42.8434,6.625,0.150943396,91.5
Mentrita DO Grenache Daniel Gómez Jiménez-Landi Las Uvas de la Ira,Spanien,2018,26.5,4,102,0,R,67.0707,40.3131,1.27778,42.8434,6.625,0.150943396,94.5
Mentrita DO Toledo Cantos del Diablo Grenache Gómez Jiménez-Landi,Spanien,2017,59,3.7,383,0,R,72.9247,40.8043,2.29503,51.3991,15.94594595,0.062711864,91.5
Merlot California Rum Barrel Aged Robert Mondavi,USA,2019,18.95,3.9,8342,0,R,67.4965,20.9616,25.9506,12.1695,4.858974359,0.205804749,94.5
Merlot Quercus Goriska Klet Brda,Slowenien,2021,9.95,3.5,817,0,R,44.375,18.107,25.3365,44.3846,2.842857143,0.351758794,Keine Punktzahl
Merlot Quercus Goriska Klet Brda,Slowenien,2022,9.95,3.5,817,0,R,44.375,18.107,25.3365,44.3846,2.842857143,0.351758794,Keine Punktzahl
Merlot Svizzera IGT Scudo dOro,Schweiz,2020,9.5,3.2,112,0,R,25.334,36.6622,25.9389,41.5954,2.96875,0.336842105,Keine Punktzahl
Merlot Ticino DOC Riserva Cantina Ciubiasco,Schweiz,2019,15.95,3.5,574,0,R,61.9539,35.9059,5.91842,45.398,4.557142857,0.219435737,Keine Punktzahl
Merlot Ticino DOC Riserva Cantina Ciubiasco,Schweiz,2021,15.95,3.5,574,0,R,61.9539,35.9059,5.91842,45.398,4.557142857,0.219435737,Keine Punktzahl
Merlot Veneto Fagiani Antonini,Italien,2022,4.2,3.3,278,0,R,64.5348,46.9842,13.6994,20.8418,1.272727273,0.785714286,Keine Punktzahl
Mestízaje Mustiguillo,Spanien,2018,15.5,3.7,7935,0,R,61.5222,41.45,11.7138,47.0526,4.189189189,0.238709677,94.5
Mestízaje Mustiguillo,Spanien,2019,15.5,3.7,7935,0,R,61.5222,41.45,11.7138,47.0526,4.189189189,0.238709677,93.5
Minervois La Livinière AOP Les Planels Château Maris,Frankreich,2021,19.95,4,2441,1,R,66.5858,57.0332,10.8958,62.4563,4.9875,0.200501253,88.5
Monica di Sardegna DOC Perdera Argiolas,Italien,2020,15.9,3.7,7929,0,R,79.0578,41.7942,25.656,28.8301,4.297297297,0.232704403,89.8
Montefalco DOCG Sagrantino Scacciadiavoli,Italien,2017,19.95,4.1,6730,0,R,58.5678,53.2625,7.57991,45.9689,4.865853659,0.205513784,88.5
Montepulciano dAbruzzo DOC Tre Saggi Tenuta Talamonti,Italien,2017,16.95,3.8,3654,0,R,40.9104,40.9943,8.16439,63.2795,4.460526316,0.224188791,88.5
Montepulciano d`Abruzzo DOC Edizione limitata Casale Vecchio,Italien,2022,14.5,3.8,17940,0,R,39.5101,41.6377,13.9131,64.1591,3.815789474,0.262068966,Keine Punktzahl
Monterrei DO Godello Mara Martin Bodegas Martin Codax,Spanien,2022,13.95,3.7,6735,0,W,40.7292,5.00347,59.5833,,3.77027027,0.265232975,Keine Punktzahl
Montsant DO Cuvée Blau,Spanien,2020,14.9,3.7,10381,0,R,77.451,48.677,7.2136,54.7271,4.027027027,0.248322148,93.2
Montsant DO Cuvée Can Blau,Spanien,2019,21.9,3.7,10381,0,R,77.451,48.677,7.2136,54.7271,5.918918919,0.168949772,93.5
Montsant DO Cuvée Can Blau,Spanien,2020,21.9,3.7,10381,0,R,77.451,48.677,7.2136,54.7271,5.918918919,0.168949772,93.2
Montsant DO Cuvée Mas de Can Blau,Spanien,2016,47.9,4.2,2129,0,R,77.9756,51.0114,16.6559,50.2261,11.4047619,0.087682672,93.8
Moscato dAsti DOCG Araldica,Italien,2023,9.95,3.9,2585,0,W,29.5149,33.2535,0],,2.551282051,0.391959799,Keine Punktzahl
Moscato dAsti DOCG Araldica,Italien,2022,5.45,3.9,2585,0,W,29.5149,33.2535,0],,1.397435897,0.71559633,Keine Punktzahl
Moscato dAsti DOCG Araldica,Italien,2023,5.45,3.9,2585,0,W,29.5149,33.2535,0],,1.397435897,0.71559633,Keine Punktzahl
Moscato dAsti DOCG Conica Araldica,Italien,2023,11.95,3.9,2585,0,W,29.5149,33.2535,0],,3.064102564,0.326359833,Keine Punktzahl
Mosel QbA Riesling Spätlese Piesporter Goldtröpfchen VDP Grosse Lage Weingut Vereinigte Hospitien,Deutschland,2021,17.95,3.9,98,0,W,37.0689,29.0217,78.1614,,4.602564103,0.217270195,95.5
Mosel Villa Huesgen Riesling By the Glass,Deutschland,2020,15.5,3.7,3310,0,W,37.1285,2.79339,83.2847,,4.189189189,0.238709677,94.5
Moulin-à-Vent AOP Les Michelots,Frankreich,2022,7.95,3.3,534,1,R,6.19958,17.5882,7.76156,72.5693,2.409090909,0.41509434,Keine Punktzahl
Mouton Cadet Sauvignon Blanc,Frankreich,2022,11.95,3.4,3885,0,W,60.9908,11.2854,46.9929,,3.514705882,0.284518828,Keine Punktzahl
Mouton Cadet Sauvignon Blanc,Frankreich,2022,4.95,3.4,3885,0,W,60.9908,11.2854,46.9929,,1.455882353,0.686868687,Keine Punktzahl
Müller-Thurgau AOC Gropp Untersee,Schweiz,2021,13.5,3.7,106,0,W,5,17.5,17.5,,3.648648649,0.274074074,Keine Punktzahl
Nahe QbA Riesling Karthäuser Weingut Tesch,Deutschland,2022,19.95,3.8,1091,0,W,46.7311,6.32207,82.9277,,5.25,0.19047619,Keine Punktzahl
Nahe QbA Riesling Karthäuser Weingut Tesch,Deutschland,2021,19.95,3.8,1091,0,W,46.7311,6.32207,82.9277,,5.25,0.19047619,95.5
Nahe QbA Riesling Schlossböckelheimer Vulkanstein Weingut K.H. Schneider,Deutschland,2022,15.95,3.8,287,0,W,41.1193,0.869285,83.689,,4.197368421,0.238244514,Keine Punktzahl
Nahe QbA Riesling Schlossböckelheimer Vulkanstein Weingut K.H. Schneider,Deutschland,2021,15.95,3.8,287,0,W,41.1193,0.869285,83.689,,4.197368421,0.238244514,95.5
Nahe QbA Riesling trocken Weisses Rauschen Weingut Tesch für Die Toten Hosen,Deutschland,2021,16.95,3.7,231,0,W,42.4182,5.67053,78.5603,,4.581081081,0.218289086,95.5
Napa Sauvignon Blanc Estate Grown Cuvaison,USA,2019,27,3.8,280,0,W,41.4681,0,69.2027,,7.105263158,0.140740741,Keine Punktzahl
Naturaplan Bio Aargau AOC Fricker Blauburgunder,Schweiz,2022,14.5,3.4,28,0,R,20.125,39.75,0.125003,72.875,4.264705882,0.234482759,Keine Punktzahl
Naturaplan Bio Abbaye de Mont Mont-sur-Rolle La Côte AOC,Schweiz,2022,13.95,3,232,0,W,24.5614,13.4126,61.4295,,4.65,0.215053763,Keine Punktzahl
Naturaplan Bio Alentejo DOC Colheita Marqués de Borba João Portugal Ramos,Portugal,2021,9.95,3.8,11571,0,R,58.4377,45.9334,17.1743,41.9552,2.618421053,0.381909548,Keine Punktzahl
Naturaplan Bio Alentejo DOC Marquês de Borba Colheita Joâo Portugal Ramos,Portugal,2021,9.95,3.8,11571,0,W,58.4377,45.9334,17.1743,41.9552,2.618421053,0.381909548,Keine Punktzahl
Naturaplan Bio Alentejo DOC Marquês de Borba Colheita Joâo Portugal Ramos,Portugal,2022,9.95,3.8,11571,0,W,58.4377,45.9334,17.1743,41.9552,2.618421053,0.381909548,Keine Punktzahl
Naturaplan Bio Alicante DO Viñas Viejas Castillo de Alicante,Spanien,2018,8.95,3.4,261,0,R,55.2565,47.2794,0,48.4379,2.632352941,0.379888268,94.5
Naturaplan Bio Alsace AOC Gewürztraminer Kuehn,Frankreich,2022,12.95,3.9,356,0,W,61.2974,39.0748,19.4544,,3.320512821,0.301158301,Keine Punktzahl
Naturaplan Bio AOP Châteauneuf-du-Pape Terra Amata,Frankreich,2022,24.95,3.8,937,0,R,78.5048,45.4183,13.4145,52.2222,6.565789474,0.152304609,Keine Punktzahl
Naturaplan Bio Basel-Landschaft AOC Arlesheimer Blauburgunder Schloss Birseck,Schweiz,2021,19.95,3.5,51,0,R,0,17.5,0,80,5.7,0.175438596,Keine Punktzahl
Naturaplan Bio Basel-Landschaft AOC Arlesheimer Blauburgunder Schloss Birseck,Schweiz,2022,19.95,3.5,51,0,R,0,17.5,0,80,5.7,0.175438596,Keine Punktzahl
Naturaplan Bio Bergerac AOC Mirabelle du Château de la Jaubertie,Frankreich,2020,15.95,3.9,1302,0,R,79.8331,56.183,22.8978,75.8614,4.08974359,0.244514107,93.5
Naturaplan Bio Blauer Zweigelt Biokult,Österreich,2022,11.5,3.1,178,0,R,42.5,56.8229,0,65.8802,3.709677419,0.269565217,Keine Punktzahl
Naturaplan Bio Carmenère Cabernet Novas Gran Reserva Colchagua Valley D.O. Chile,Chile,2019,9.95,3.7,11062,0,R,85,56.6698,8.03199,44.29,2.689189189,0.371859296,94
Naturaplan Bio Castel del Monte Almagia Rosso Giancarlo Ceci,Italien,2019,11.5,3.7,248,0,R,82.7569,47.0721,18.3283,17.9662,3.108108108,0.32173913,93.3
Naturaplan Bio Castel del Monte DOC Parco Grande,Italien,2021,6.95,3.3,704,0,R,78.9097,46.8441,27.1427,27.2727,2.106060606,0.474820144,Keine Punktzahl
Naturaplan Bio Catalunya DO Boira Garnatxa Negra Raimat,Spanien,2019,15.95,3.4,1262,0,R,74.5885,42.5844,8.28675,42.3324,4.691176471,0.213166144,93.5
Naturaplan Bio Château Gombaude-Guillot Pomerol Lécole Famille Laval,Frankreich,2019,47.5,4.3,3404,1,R,74.7643,50.2031,5.35638,52.2332,11.04651163,0.090526316,94.9
Naturaplan Bio Château Pech-Latt Corbières AOC,Frankreich,2022,7.5,3.3,64,0,R,42.5,0,55.6964,,2.272727273,0.44,Keine Punktzahl
Naturaplan Bio Château Peybonhomme Les Tours AOC,Frankreich,2021,12.5,3.9,2641,0,R,63.1717,11.275,38.522,,3.205128205,0.312,88.5
Naturaplan Bio Château Peybonhomme Les Tours Cru Bourgeois AOC,Frankreich,2021,6.95,3.5,1666,0,R,64.8245,63.0158,4.57865,67.0101,1.985714286,0.503597122,88.5
Naturaplan Bio Chianti classico Concadoro DOCG,Italien,2020,12.95,3.2,456,0,R,44.7235,63.0971,7.375,62.2721,4.046875,0.247104247,89.8
Naturaplan Bio Corbières AOP Château Caraguilhes Pre,Frankreich,2022,6.95,3.8,2014,0,R,62.4294,54.9714,6.46043,60.4294,1.828947368,0.54676259,Keine Punktzahl
Naturaplan Bio Côtes du Rhône AOP Terra Amata,Frankreich,2022,7.95,3.4,1299,0,R,60.4723,49.1336,14.9678,52.8851,2.338235294,0.427672956,Keine Punktzahl
Naturaplan Bio Côtes du Roussillon AOP John Wine Cazes,Frankreich,2023,8.7,3.6,329,1,R,64.0636,57.7696,5.95957,64.5326,2.416666667,0.413793103,Keine Punktzahl
Naturaplan Bio Demeter Waadt AOC Chasselas Libellule,Schweiz,2022,10.95,3.8,76,1,W,36.0897,16.859,55.3205,,2.881578947,0.347031963,Keine Punktzahl
Naturaplan Bio Domaine de Marcins La Côte AOC,Schweiz,2022,10.95,3.5,403,0,W,32.2898,6.28979,62.186,,3.128571429,0.319634703,Keine Punktzahl
Naturaplan Bio Féchy La Côte AOC Terre de Bionysos,Schweiz,2022,13.95,3.9,393,0,W,25.4876,8.9624,61.5787,,3.576923077,0.279569892,Keine Punktzahl
Naturaplan Bio Gewürztraminer dAlsace AOP Wolfberger,Frankreich,2022,15.95,3.7,1046,0,W,49.5114,58.0513,66.1196,,4.310810811,0.231974922,Keine Punktzahl
Naturaplan Bio Gigondas AOP Terra Amata,Frankreich,2022,18.95,3.4,584,0,R,61.7062,55.4685,10.6952,53.3733,5.573529412,0.179419525,Keine Punktzahl
Naturaplan Bio Haut-Médoc AOC Clos la Bohème,Frankreich,2019,25.5,3.9,594,0,R,78.4932,77.0676,3.42325,75.2189,6.538461538,0.152941176,94.9
Naturaplan Bio Haut-Médoc Château Micalet,Frankreich,2021,14.95,3.8,1052,1,R,71.9807,74.435,7.35429,73.328,3.934210526,0.254180602,88.5
Naturaplan Bio La Raia Gavi DOCG,Italien,2022,12.95,3.7,3769,0,W,20.0747,0.56529,79.1034,,3.5,0.285714286,Keine Punktzahl
Naturaplan Bio Languedoc-Roussillon Cap au Sud Domaine Cazes,Frankreich,2021,7.5,3.5,4294,1,R,61.9854,51.8081,10.7423,55.7671,2.142857143,0.466666667,88.5
Naturaplan Bio Le Canon du Marechal IGP Côtes Catalanes,Frankreich,2020,9.95,3.4,2256,0,R,64.2627,53.6599,6.90833,58.7198,2.926470588,0.341708543,93.5
Naturaplan Bio Monte Tabor Valpolicella Ripasso DOC,Italien,2019,15.95,3.6,803,0,R,56.6774,39.0852,26.4218,23.6913,4.430555556,0.225705329,93.3
Naturaplan Bio Neuchâtel AOC Domaine des Coccinelles,Schweiz,2022,12.95,3.5,570,0,W,30.6783,6.70223,55.4952,,3.7,0.27027027,Keine Punktzahl
Naturaplan Bio Neuchâtel AOC Domaine des Coccinelles,Schweiz,2023,12.95,3.5,570,0,W,30.6783,6.70223,55.4952,,3.7,0.27027027,Keine Punktzahl
Naturaplan Bio Parco Marano Castel del Monte DOC,Italien,2016,18.5,3.8,495,0,R,71.0965,48.7805,23.9219,29.9708,4.868421053,0.205405405,95.4
Naturaplan Bio Parco Marano Castel del Monte DOC,Italien,2019,18.5,3.8,495,0,R,71.0965,48.7805,23.9219,29.9708,4.868421053,0.205405405,93.3
Naturaplan Bio Pecorino Jasci Terre di Chieti IGT,Italien,2022,9.95,3.8,1109,0,W,42.5018,24.9827,66.3299,,2.618421053,0.381909548,Keine Punktzahl
Naturaplan Bio Piemonte Doc Barbera La Raia,Italien,2022,9.95,3.5,659,0,R,54.5521,31.2864,1.84695,68.3151,2.842857143,0.351758794,Keine Punktzahl
Naturaplan Bio Primitivo del Salento IGT Cosmo,Italien,2021,9.95,3.6,32,0,R,67.5,17.5,30,5,2.763888889,0.361809045,Keine Punktzahl
Naturaplan Bio Primitivo del Salento IGT Cosmo,Italien,2022,9.95,3.6,32,0,R,67.5,17.5,30,5,2.763888889,0.361809045,Keine Punktzahl
Naturaplan Bio Puglia IGT Susumaniello Luminante,Italien,2021,13.95,4.1,86,0,R,84.8186,42.9583,36.3134,24.5391,3.402439024,0.29390681,Keine Punktzahl
Naturaplan Bio Rioja DOCa Reserva Señorio de Arriezu,Spanien,2015,11.95,3.6,898,1,R,64.7394,60.096,10.7911,60.8018,3.319444444,0.30125523,92.8
Naturaplan Bio Rioja DOCa Reserva Señorio de Arriezu,Spanien,2016,11.95,3.6,898,1,R,64.7394,60.096,10.7911,60.8018,3.319444444,0.30125523,93.8
Naturaplan Bio Rioja DOCa Señorio de Arriezu Blanco,Spanien,2022,8.95,3.2,79,0,W,50.2969,9.20938,54.6328,,2.796875,0.357541899,Keine Punktzahl
Naturaplan Bio Rosso Toscana IGT Raphael Dal Bo,Italien,2021,16.5,3.9,222,0,R,46.5364,35.997,11.3242,35.997,4.230769231,0.236363636,Keine Punktzahl
Naturaplan Bio Rueda DO Sauvignon Blanc Marqués de Riscal,Spanien,2022,9.95,3.8,10528,1,W,40.9475,0.896155,67.2585,,2.618421053,0.381909548,Keine Punktzahl
Naturaplan Bio Saint-Emilion AOC Château Guibeau Puisseguin,Frankreich,2021,16.95,3.7,2036,0,R,72.3222,59.3399,4.31376,54.3134,4.581081081,0.218289086,88.5
Naturaplan Bio Siciliane Nero dAvola Ophelia,Italien,2022,7.95,3.8,3215,1,R,71.7792,39.173,28.0086,33.6736,2.092105263,0.477987421,Keine Punktzahl
Naturaplan Bio Soave DOC Monte Tabor,Italien,2022,9.95,4,659,0,W,85,28.1514,39.8435,30.6437,2.4875,0.40201005,Keine Punktzahl
Naturaplan Bio Tempranillo Tres Reyes,Spanien,2021,6.65,3.8,3164,1,R,62.2011,36.3741,13.4134,44.0643,1.75,0.571428571,94
Naturaplan Bio Vacqueyras Terra Amata,Frankreich,2022,11.95,3.5,34,0,R,63.9921,49.0952,0,52.8095,3.414285714,0.292887029,Keine Punktzahl
Naturaplan Bio Valais AOC Heida Domaine Jean-René Germanier,Schweiz,2021,22.95,3.9,359,0,W,37.3214,12.0112,80,,5.884615385,0.169934641,Keine Punktzahl
Naturaplan Bio Vino Rosso dItalia Vino della Casa,Italien,2021,6.5,3.4,159,0,R,51,55,0,71.75,1.911764706,0.523076923,Keine Punktzahl
Naturaplan Bio Vully Chasselas Convivial,Schweiz,2022,15.95,3.9,43,0,W,21.4811,0,54.1132,,4.08974359,0.244514107,Keine Punktzahl
Naturaplan Bio Vully Chasselas Convivial,Schweiz,2023,15.95,3.9,43,0,W,21.4811,0,54.1132,,4.08974359,0.244514107,Keine Punktzahl
Naturaplan Bio Yecla DO Campo Arriba,Spanien,2021,9.95,3.6,7683,0,R,74.3327,46.8605,9.82712,49.9529,2.763888889,0.361809045,94
Naturaplan Bio-Amarone della Valpolicella DOC Monte Tabor,Italien,2017,32.95,4,659,0,R,85,28.1514,39.8435,30.6437,8.2375,0.121396055,88.5
Naturaplan Bio-Aude Hauterive IGP Cigalus Rouge Gérard Bertrand,Frankreich,2021,35.95,3.6,30740,0,R,62.8735,48.3212,4.80374,54.1456,9.986111111,0.100139082,88.5
